Title,Abstract,Authors,digitalObjectIdentifier,research tool
Energy Conservation. CORD Energy Technology Series,"This course in energy conservation is one of 16 courses in the Energy Conservation-and-Use Technology curriculum. Intended for use in two-year postsecondary technical institutions to prepare technicians for employment, the courses are also useful in industry for updating employees in company-sponsored training programs. Comprised of seven modules, the course is designed to give the student technical knowledge and specific skills required to perform conservation measures relative to the most common energy uses. The student learns and utilizes the basic principles of energy conservation and efficiency. Written by a technical expert and approved by industry representatives, each module contains the following elements: introduction, prerequisites, objectives, subject matter, exercises, laboratory materials, laboratory procedures (experiment section for hands-on portion), data tables (included in most basic courses to help students learn to collect or organize data), references, and glossary. Module titles are Energy Conservation--An Introduction, Conservation Principles and Efficiency Measurements (CPEM)--Space Heating, CPEM--Space Cooling, CPEM--Hot Water and Steam Supply Systems, CPEM--Illumination, CPEM--Electric Motors, and CPEM--Building Construction. (YLB)",,,ProQuest
Stationary Engineering Science Manual--3,"This manual provides in-depth coverage of topics related to boiler operations. The assignments contain an objective, descriptive information, reference sources, procedures, and assignments. Sixteen units are provided and address topics such as: (1) steam engineering concepts; (2) boiler fittings; (3) feed-water, steam, and combustion accessories; (4) combustion; (5) boiler-water conditioning; (6) electrical components; (7) pumps; (8) turbines; (9) lubrication; (10) plant operation; (11) service and maintenance; and (12) license preparation. Several diagrams complement the activity units. Numerous engineering drawings are included. (ML)","Steingress, Frederick M.;And Others",,ProQuest
Cost Reduction Incentive Awards. 1981 Winners,Brief descriptions of 47 college programs recognized for awards in the National Association of College and University Officers/U. S. Steel Foundation Cost Reduction Incentive Awards Program are given. They include awards for: shower stall repair; chemical waste exchange; vibrating alarms for hearing-imparied; self-funding insurance consortium; livestock bedding as fuel; in-house cable TV installation; movable library storage; antivandalism partnership; retrofit of absorption chiller; selling university equipment; heat and water recovery; decreasing postage costs; silver recovery; earned time for employee absences; centralized irrigation control; low-pressure operation of heating plant; single identification card system; video tapes for student orientation; office automation; centralized gas water heating; reducing vehicle travel costs; landscaping; conserving wasted water; modifications to absorption chiller; waste water use in cooling towers and irrigation; electric lighting used for heat; telephone interviews; daily cash deposits; electrical machines replacing steam units; flashing light telephone signals; bulletin mailings; automatic flush tanks modification; blower shaft repairs; wood chip burning; clock/classroom bell improvement; computer-controlled inventory; residence hall heating control; replacing glass with Lexan; sheathing an old building; in-house book repair; multi-use movable wall dividers; using excess solar-heated water for a pool; reducing boiler pressure and temperature; recovering waste heat; and a new-style dishwashing machine. A list of 1980 winners is appended. (MSE),,,ProQuest
Geothermal Energy: Resource and Utilization. A Teaching Module,"The search for new energy resources as alternatives to fossil fuels have generated new interest in the heat of the earth itself. New geothermal areas with a variety of characteristics are being explored, as are new ways of extracting work from naturally heated steam and hot water. Some of this effort is discussed in this three-part module. Five types of geothermal resources and their development and utilization are reviewed in the first section. Geothermal energy and related principles are discussed in the second section. These include: force, work, energy, power; absolute temperature and pressure; heat engines, carnot engine; enthalpy; and availability and maximum work. Geothermal energy utilization is discussed in the third section, focusing on electricity generated from and non-electrical applications of geothermal energy. Also included in the module are study questions (with answers), a list of references, and, in appendices, measurement tables and tables of properties of saturated steam and saturated water (temperature, pressure) and properties of superheated steam and compressed water (temperature and pressure). The module contains the equivalent of 1-week's material and is suitable for use in introductory college physics courses and in advanced high school physics programs. (JN)","Nguyen, Van Thanh",,ProQuest
Stationary Engineering Laboratory--2. Teacher's Guide,"The Stationary Engineering Laboratory Manual 2 Teacher's Guide was designed as an aid to the instructors of vocational-technical high school students who have received instruction in the basics of stationary engineering. The course of study was developed for students who will be operating a live plant and who will be responsible for supplying steam for heating, cooking, and baking. Each lesson in the teacher's guide lists behavioral objectives, teaching aids, procedures, summary points, testing suggestions, and assignments. The Major units are: engineering fundamentals, steam boilers, boiler fittings, boiler room systems, feed-water accessories, steam accessories, fuels, combustion accessories, combustion, boiler plant instruments, boiler water conditioning, compressed air system, electrical, operation, and service and maintenance. (NJ)","Steingress, Frederick M.;Frost, Harold J.",,ProQuest
Stationary Engineering Laboratory Manual--2,"The Stationary Engineering Laboratory Manual 2 was designed for vocational/technical high school students who have received instruction in the basics of stationary engineering. It was developed for students who will be operating a live plant and who will be responsible for supplying steam for heating, cooking, and baking. Each lesson in the manual lists behavioral objectives, needed apparatus, procedures, and assignments. The major units are: engineering fundamentals, steam boilers, boiler fittings, boiler room systems, feed-water accessories, steam accessories, fuels, combustion accessories, combustion, boiler plant instruments, boiler water conditioning, compressed air system, electrical, operation, and service and maintenance. (NJ)","Steingress, Frederick M.;Frost, Harold J.",,ProQuest
"Industrial Arts Power Mechanics. Applying Scientific Principles to Power, Energy, Force. Instructional Units","The instructional units and related materials in this guide are designed to assist in the preparation of courses of study/instruction in (1) power mechanics specifically, (2) power mechanics which serve as introductory courses in other areas of industrial arts, and (3) automotive mechanics which also cover the broader aspects of power mechanics. Each unit presents a broad coverage of the topic indicated by its title, covers the scientific principle involved, suggests methods of applications of the technical and scientific information, and lists selected references to further technical and scientific information. These references are keyed by numbers in parentheses to the complete list of selected references at the end. There are 40 units presented under seven section headings: (1) Natural Power (muscle power, waterwheels, windmills, heat collectors, and solar stills); (2) Mechanical Power (simple and compound machines, lubrication, springs, clutches, and dynamometers), (3) Steam Power (steam engines and turbines), (4) Thermal Power (high-energy rate forming, powder-actuated tools, jet and rocket engines, gasoline testing, carburetion, two- and four-cycle engines, wankel engines, thermostats, and welding processes), (5) Electrical Power (dry cells: primary cells, storage batteries: secondary cells, generation of electricity, transmission of electric power, transformers, spark plugs, ignition systems, electric motors, fuel cells, photoelectric cells, and semiconductor power rectifiers), (6) Hydraulic Power (jacks and presses, machine tools, braking systems, fuel pumps, power steering, and air conditioners), and (7) Pneumatic Power (air-powered tools, spray guns, and vacuum pumps). Appendix A presents a relatively brief course outline for industrial arts power mechanics, and appendix B a comprehensive course outline for industrial arts automotive mechanics. Appendix C contains terminology on the storage battery. Appendix D is assignment sheets. (JT)","Woodward, Robert L.;Myers, Norman L.",,ProQuest
AASA Convention Highlights--Schoolmen Don't Work Up Much Steam This Year,"Highlights of Annual Convention of the American Association of School Administrators (Atlantic City, N.J., February 15-19, 1969).",,,ProQuest
"Celestial calendar-paintings and culture-based digital storytelling: cross-cultural, interdisciplinary, STEM/STEAM resources for authentic astronomy education engagement","In D(L)akota star knowledge, the Sun is known as Wi and the Moon is Han-Wi. They have an important relationship, husband and wife. The pattern of their ever-changing relationship is mirrored in the motions of Sun and Moon as seen from our backyards, also called the lunar phases. The framework of the cultural teaching is storytelling and relationships. Cultural perspectives in astronomy such as this remind us of how indigenous ways of knowing are rooted in inclusion, engagement, and relevancy. Designed by A. Lee in 2007, the Native Skywatchers initiative seeks to remember and revitalize indigenous star and earth knowledge, promoting the native voice as the lead voice. The overarching goal of Native Skywatchers is to communicate the knowledge that indigenous people traditionally practiced a sustainable way of living and sustainable engineering through a living and participatory relationship with the above and below, sky and earth. In 2012 two indigenous star maps were created: the Ojibwe Giizhig Anung Masinaaigan-Ojibwe Sky Star Map (A. Lee, W. Wilson, C. Gawboy), and the D(L) akota star map, Makoce Wicanhpi Wowapi (A. Lee, J. Rock). In 2016, a collaboration with W. Buck of the Manitoba First Nations Resource Centre (MFNRC), produced a third star map: Ininew Achakos Masinikan-Cree Star Map Book. We aim to improve current inequities in education for native young people especially through STEM engagement, to inspire increased cultural pride, and promote community wellness. Presented here will be recently created resources such as: astronomical calendar-paintings and short videos that exist at the intersection of art-science-culture. As we look for sustainable ways to widen participation in STEM, particularly in astronomy education, part of the conversation needs to consider the place for art and culture in STEM.","Lee, AS; Wilson, W; Tibbetts, J; Gawboy, C; Meyer, A; Buck, W; Knutson-Kolodzne, J; Pantalony, D",10.1051/epjconf/201920001002,WOS
STEAM-Learning to Mars: Students' Ideas of Space Research,"Multidisciplinarity and the enrichment of science and mathematics education toward the so-called STEAM-approach where the A stands for art, has raised a lot of academic interest in the past decade. In this study, 5th and 6th graders from the greater Helsinki area (N = 390) participated in a several months long, Mars-colonization themed STEAM-learning intervention. Testing the students' science knowledge using pre- and post-tests, their learning outcomes were compared to those of 5th and 6th graders from a control school (N = 119), who during the same period studied STEM-subjects in a more traditional manner. The main factors that were taken into account during the comparisons were gender and academic achievement level. Based on only whether there was any improvement between the pre- and post-test scores, girls were found to have benefitted from the Mars-module more than boys did. While also considering the magnitude of the said improvement, no significant difference in the effectiveness of the learning module was found between genders. The group of academically highest-achieving students improved their test scores the most after participating in the STEAM-learning module. This is an important, somewhat surprising finding, as often informal, outside of school learning has been found to benefit especially students with lower grade point averages.","Piila, E; Salmi, H; Thuneberg, H",10.3390/educsci11030122,WOS
"Lasers, penguins, and polar bears: Novel outreach and education approaches for NASA's ICESat-2 mission","NASA's Ice, Cloud, and land Elevation Satellite (ICESat-2), to be launched in 2018, will measure the height of Earth from space using lasers, collecting the most precise and detailed account yet of our planet's elevation. The mission will allow scientists to investigate how global warming is changing the planet's icy polar regions and to take stock of Earth's vegetation. ICESat-2's emphasis on polar ice, as well as its unique measurement approach, will provide an intriguing and accessible focus for the mission's education and outreach programs. Sea ice and land ice are areas that have experienced significant change in recent years. It is key to communicate why we are measuring these areas and their importance. ICESat-2 science data will provide much-needed answers to climate change questions such as, Is the ice really melting in the polar regions? and What does studying Earth's frozen regions tell us about our changing climate? In this paper, lessons-learned and novel techniques for engaging and educating all audiences in the mission will be discussed, such as including results of a unique collaboration with art design school the Savannah College of Art Design (SCAD) to create fun and exciting products such as animated characters and interactive stories. Future collaborations with wildlife researchers, a new citizen science program in collaboration with GLOBE, and evidence from other STEAM (Science, Technology, Engineering, Arts, Math) education approaches will also be detailed in this paper.","Casasanto, VA; Campbell, B; Manrique, A; Ramsayer, K; Markus, T; Neumann, T",10.1016/j.actaastro.2018.04.011,WOS
Modeling and Simulation of a Satellite Training Kit for Providing Space Systems Engineering Knowledge and Technological Development in STEAM,"Aerospace Engineering is an emerging division of modern engineering nowadays. Many space programs have been taken lately at the graduate and post-graduate levels to familiarize the topic to the students. As a result, space technological knowledge and research have been limited to postgraduate and doctorate students. Undergraduate, college and school students do not get proper access to space-related knowledge. Moreover, nowadays small satellites are very popular for educational and research purposes as big satellites are costly and too complex for starters. For school and college students, it is very hard to understand the system and functions of satellites due to the limitation of space system knowledge. There are some satellite training kits in the market that can help the students to understand the systems and structure of a satellite. However, the few available satellite training kits are very much expensive. The demonstration of such a satellite training kit with a proper program can eradicate the limitation of the availability of space education and keep growing interest among the students about satellite technology. In this thesis project, a systematic architecture has been proposed that can provide the students with space systems engineering experience through demonstration, assembly, integration, and operation of a satellite training kit. The whole architecture has four parts 1) Simulation, 2) Mechanical, 3) Electrical, and 4) Software. In this thesis, to prove our whole concept we will complete the mechanical and electrical simulations of the satellite training kit.","Bhuiyan, MKB; Islam, MS; Sanvi, TI; Talukder, MJH; Antara, RSI; Azad, AKMAM",10.1109/IEACON51066.2021.9654632,WOS
From STEM to STEAM: Towards Aerospace Partnerships with Cultural Heritage Diagnostics,"What would happen if archaeology and aerospace joined forces to test and develop new technology? Not only would it be the basis for an epic movie, there is considerable need in emerging fields of archaeology, like cultural heritage diagnostics, where a fruitful partnership could be forged. Both cultural heritage diagnostics and engineering groups share needs for multi-dimensional and multi-spectral surveying, immersive collaboration environments for visualizing results for analytics, and layered reality annotation systems to engage the scientific community and capture crowd-sourced feedback. The University of California, San Diego (UCSD) hosts the Center of Interdisciplinary Science for Art, Architecture, and Archaeology (CISA3), which is focused on engineering and adapting technology towards cultural heritage diagnostics for these purposes. CISA3 would like to build and consolidate new bridges between industry, academia, and government research to develop, test, and explain new tools to explore the cultural world around us with systems typically dreamt of in science fiction space exploration. Science, Technology, Engineering, and Mathematics (STEM) education and research is highly lauded as a means to maintain and improve society's problem-solving prowess. Recent years have seen a movement to put the Arts into the middle of STEM, thus transforming it into STEAM, to foster innovation and to deliver comprehensive, sustainable solutions to a wide range of problems and opportunities, especially those that are culturally sensitive. Utilizing this emphasis on an expanded definition of the 'arts' - specifically art, architecture, and archaeology a la CISA could help the aerospace industry and its many offshoots by both providing a culturally accessible entry point to engage the masses to recruit new generations of Indiana-Jones space exploration-engineers and act as a test bed for equipment and training. Deeper collaborations with aerospace offer cultural heritage diagnostics the chance to extend its ongoing dialogue between those who can identify practical field problems for which technology has not yet been invented, like archaeologists and art historians, and the computer scientists and engineers who are capable of constructing solutions. This paper explores ways that cultural heritage diagnostics with CISA3 and similar organizations bridge the gap between pure and applied science in turn smudging the lines between the hard and soft sciences. It will explore the ways in which a STEAM movement focused not just on arts, but on art, architecture, and archaeology may be the path towards the productive and innovative collaborations between academia, industry, and government which have long been dreamed of, but not yet fully achieved. This paper will suggest ways in which cultural heritage diagnostics entities might partner with the aerospace industry to evolve well-rounded tools that reveal and preserve the treasure of our past to present audiences - to inspire and enable a future for humankind on and beyond planet Earth.","Richter, AM; Petrovic, V; Kuester, F; Seracini, M; Angelo, R",,WOS
Federal STEM Policy and Politics and Their Impact on Astronomy EPO: Reflections and Provocations,"The federal government invests more than $3 billion each year across its various units in supporting STEM education and outreach. Efforts in recent years to understand and better coordinate these investments have resulted in considerable push back, particularly those efforts that aimed at consolidation and elimination of programs deemed ineffective or duplicative. While initial plans to streamline federal STEM education were defeated, many agencies nonetheless saw cuts and elimination, and a high-level effort to coordinate STEM education at the cross-agency level is now gaining steam (CoSTEM: Committee on Science, Technology, Engineering, and Mathematics Education). What do all of these developments mean for education and public outreach in astronomy and related fields? How should this community operate within the opportunities and threats that CoSTEM might pose? Former director of the National Academy of Science's Board on Science Education, and now director of the Center for Research on Lifelong STEM Learning, Martin Storksdieck, reflected on past and recent developments from the perspective of a close observer, and from the perspective of someone who has been involved in astronomy education research and evaluation for nearly 20 years. Shelley Canright, Senior Advisor for Education Integration at the NASA Office of Education, shared her insights and perspectives with respect to CoSTEM and EPO, in particular from co-chairing the Federal Coordination in Science, Technology, Engineering, and Mathematics Education (FC-STEM) group.","Schultz, G; Storksdieck, M; Canright, S",,WOS
Is there deep learning on Mars? STEAM education in an inquiry-based out-of-school setting,"Learning intervention based on a Mars and Space exhibition was designed according to STEAM-education (Science, Technology, Engineering, Art and Mathematics) principles and practices in order to bridge the gap between formal and informal learning. The cognitive learning of 12-year-old students in Finland (N = 306) showed a sustained level for a six months period. The results of this study provided evidence that situational motivation was enhanced by interest in school science in the STEAM science exhibition context. This led to better cognitive learning results in the post-knowledge test. Thus, interest and situational motivation were the first steps, and the superficial situational motivation seemed to successfully change into content-based intrinsic motivation with longer-lasting, deep learning outcomes. STEAM intervention apparently produced long-term learning, and this exhibition learning setting is shown to provide an appropriate platform to reach the deeper layers to successfully retain knowledge. Boys' scores rose even in the delayed test. Using structural equation modelling (SEM) to assess the effects on individual, motivational and situational interest in learning, situation motivation is shown to work as a catalyst and acting as a catalyst and also acted as a stepping stone for intrinsic motivation as part of relative autonomy (RAI) and a deep learning strategy.","Salmi, HS; Thuneberg, H; Bogner, FX",10.1080/10494820.2020.1823856,WOS
Old Nishiki-e as Learning Tool for Contemporary Digital Object -based Learning in STEAM Education,"Universities are collectively advancing education and research activities to resolve obstacles to a sustainable future. STEAM education has thus recently gained fraction for students' multisensory activities to encourage scientific thinking along with creativity. Object-based learning is an active learning method that utilizes curated collections and objects placed in museum settings. This paper illustrates the benefits of OBL with artistic/scientific nishiki-e as a STEAM education tool for a teaching material. Through digital OBL including survey and curation in digital space by student participants, it was shown that digital OBL is efficacy as a STEAM education.","Tanabashi, S",10.1109/ISET52350.2021.00052,WOS
THERMAL PERFORMANCE AND EVALUATION OF SUPERHEATED STEAM DRYING SYSTEM USING SOLAR-ASSISTED ABSORPTION HEAT TRANSFORMER,"This paper summarizes the main results of our study carried out under the priority-area research  Energy Conversion and Utilization with High Efficiency supported by the grant-in-aid of scientific research from the Ministry of Education, Science and Culture of Japan. In the research we focused on applications of solar energy utilization for industrial drying systems. In this paper a new concept of a closed drying system with superheated steam provided from a temperature boosting type heat pump (absorption type heat transformer) was proposed. The heat transformer is driven directly by heat from a solar collector. The performance for different three drying periods and a number of factors affecting it were predicted by a computer simulation. Furthermore the heat and mass transfer characteristics of water evaporation into superheated steam stream by radiative and convective heating were indicated experimentally. It was concluded that the system would be useful for industries where high temperature(over 100-degrees-C) drying is required.","NOMURA, T; NISHIMURA, N",10.1080/07373939208916470,WOS
