Title,Abstract,Authors,digitalObjectIdentifier,research tool
"Editorial Board Thoughts: Arts into Science, Technology, Engineering, and Mathematics - STEAM, Creative Abrasion, and the Opportunity in Libraries Today","Rather than a continued focus on hyper-specialization and separation, we have the opportunity to rethink the library: exploring novel configurations and services that might better support its community, and embracing emerging roles of trans-disciplinary collaboration and innovation. The Library as Intersection Libraries reflect the institutional and organizational structures of their communities, even as the physical organization of the structures built to house print collections mirror the classification system in use. Specialized almost to the exclusion of other areas of study altogether, in branch libraries of a college or university this division can reach a pinnacle; libraries and collections devoted to exclusive topics of engineering, science, music, and others, exist on campuses across the country. Without active intervention and deliberate effort on the part of the library, opportunities for creative abrasion3 and trans-disciplinary collaboration become virtually non-existent; its potential to ""unleash the creative potential that is latent in a collection of unlike-minded individuals,""4 untapped. ""6 And yet a quick review of the literature reveals that knowledge creation, innovation, and success are inextricably linked7, with the fundamental understanding of their connection having undergone a dramatic shift: ""knowledge is in fact essential to innovate, and while this might sound obvious today, putting knowledge and innovation and not physical assets at the centre of competitive advantage was a tremendous change. ""8 As our libraries move toward embracing an even more active role within our communities, our organizational priorities are undergoing similarly dramatic shifts: support for knowledge creation and innovation becomes more central, even as...","Colegrove, Tod",,ProQuest
Cases on STEAM Education in Practice,"Curriculums for STEM education programs have been successfully implemented into numerous school systems for many years. Recently, the integration of arts education into such programs has proven to be significantly beneficial to students, resulting in a new method of teaching including science, technology, engineering, art, and mathematics. ""Cases on STEAM Education in Practice"" is an essential research publication for the latest scholarly information on curriculum development, instructional design, and educational benefits of STEAM learning initiatives. Featuring coverage on a range of topics including fine arts, differentiated instruction, and student engagement, this book is ideally designed for academicians, researchers, and professionals seeking current research on the implementation of STEAM education. Following a preface (Judith A. Bazler and Meta Van Sickle), contents include: (1) Introduction (Judith A. Bazler and Meta Van Sickle); (2) Musing on Unanswered Questions (Meta Van Sickle and Merrie Koester); (3) Graphic Novels and STEAM: Strategies and Texts for Utilization in STEAM Education (Alex Romagnoli); (4) High-Quality Trade Books and Content Areas: Planning Accordingly for Rich Instruction (Carolyn A. Groff); (5) Getting to ""Know"" STEAM (Merrie Koester); (6) Exploring Simple Machines With Creative Movement (William Paul Lindquist, Martha James-Hassan, and Nathan C. Lindquist); (7) Theater as the STEAM Engine for Engaging Those Previously Disengaged (Paul C. Jablon); (8) ""Imagioneering"" a New Mission Space (Kyle Seiverd); (9) Bee Pollination (Kerry Carley Rizzuto, John Henning, and Catherine Duckett); (10) Finding and Using the ART in Science Lessons (Kevin D. Finson); (11) Tower Design as a STEAM Project (Judith A. Bazler); (12) Using Air to Move Paper Airplanes and Balloon Rockets: The Great Race (Letitia Graybill); (13) A Mathematical Approach to Designing Insulators (Kathryn E. Pedings-Behling); (14) Constructing a Marshmallow Catapult (Warren James DiBiase, Judith R. McDonald, and Kellan Strong); (15) Engineering and Art: Putting the EA in STEAM (Sara B. Smith); (16) Using STEAM in Marine Science: Incorporating Graphic Design Into an Existing STEM Lesson (Callie Dollahon); (17) Cases on STEAM Education in Practice: Differentiated Instruction (Kathryn L. Servilio); and (18) Conclusion (Diane Cudahy). A compilation of references, information about the contributors, and an index are included.",,10.4018/978-1-5225-2334-5,ProQuest
STEM and the Arts and Humanities: Debunking a False Dichotomy,"The false dichotomy that suggests schools must choose between STEM (or STEAM) and the humanities would not merit the time it takes to write an article if not for a dangerous crescendo of backlash clouding the senses of boards and administrations around the independent school world. In this article, the author, an upper school principal of Taipei American School (Taiwan), shares how the school in which he works embraces both STEM and the humanities equally. Taipei American School is a K-12 American independent school located in a vibrant international capital city. It is clear to the author that vibrant, challenging arts and humanities courses are as relevant and popular as ever, and embracing STEM neither condones nor encourages slighting the humanistic heritage that gives meaning to science, technology, engineering, and mathematics.","Hartzell, Richard",,ProQuest
Live Contact with the International Space Station from School,"The Royal Masonic School for Girls made history in February 2016 when it became the first school to establish a video link with the International Space Station via amateur radio--the result of a competition run by ARISS. Six girls from year 9 (age 13-14 years) qualified for Foundation Amateur Radio Licences, and students across the school took part in space-related activities during the buildup to the link-up. During the 10 minute link-up, made possible by the ARISS UK Operations team, students could see Tim on a big screen and asked him prepared questions covering space activities and careers; the event was also streamed live. This unique event provided considerable insight into ""physics in action"" and visits by speakers from the European Space Agency, defence, aerospace and security agency QinetiQ, Airbus, and a former student now at the UK Space Agency, have enthused our students about science, technology, engineering, arts and mathematics (STEAM) careers.","Timoney, Natalile",,ProQuest
Young Makers Compare Science Fairs and Maker Faires,"Participation in the school-based science fair is ubiquitous to the middle-school student. Rising in popularity is the community based, extracurricular Maker Faire for the young tinkerer or maker. With this study, we share perceptions of these 2 canonical STEM events from the perspective of Young Makers. We report on the perceptions of science fairs and Maker Fairs from the perspective of 35 young Makers ages 7-18, who participated in a flagship Maker Faires in the United States. Using thematic analysis we analyze their responses during qualitative interviews and report on their impressions of their science fairs and Maker Faires experiences. Both science fairs and Maker Faires present authentic STEM learning opportunities for the K-12 student. They have similar formats where the student presents work that they have done, both the process and end product or result. Opportunities often arise in both to engage and excite a student in an area of curiosity. Both types of fairs want their participants to interact with each other and provide each other with feedback and a learning environment. They also want the participants to well document their projects. Emerging themes indicate both similarities and differences and how those affect the projects represented in each. Both types of fairs are unique and provide a learning experience for their respective participants. Participating in Maker Faires is, study participants believe, provides more applied learning about science, engineering, and community concepts as compared to their participation in science fairs. Maker Faires may provide an opportunity for schools to promote deeper learning. Additional analysis will explore this further. An example of a science fair is the Intel International Science and Engineering Fair, around since the 1950s. ISEF materials define science fair as “research [as]… a process by which people discover or create new knowledge about the world in which they live…Students design research projects that provide quantitative data through experimentation followed by analysis and application of that data.” Specific learning objectives are learning the scientific method, answering a question, and communicating their research clearly. The science fair also offers an opportunity for feedback on how their project compares to others in a competitive school setting (with awards at the local, regional and national competition level). Organizers describe Maker Faire as “part science fair, part county fair, and part something entirely new, …an all-ages gathering of tech enthusiasts, crafters, educators, tinkerers, hobbyists, engineers, science clubs, authors, artists, students, and commercial exhibitors.” Maker Faires have become increasingly popular since inception more than 10 years ago, with attendance at flagship Bay Area Maker Faire reaching 130,000 and 85,000 at the flagship New York Maker Faire. Aims are promoting self-motivated learning, give makers a place to freely show of their project, and to be transformation educational experience. An increasing trend is bringing making activities to K-12 in the classroom, in collaborative maker spaces, and through clubs. This may allow for opportunities to benefit from both science fairs and Maker Faires, including a new initiative to have Maker Faires at schools. We will present implications for STEM and STEAM informal learning and means to engage in STEM, and particularly engineering, in and outside of the science classroom in K-12 education.","Mabey, Miles J;Lande, Micah;Jordan, Shawn S",10.18260/p.27066,ProQuest
MAKER: Come to the Dark Side—We Have Cookies: Creating an Interactive Display to Engage Everyone in STEAM,"In a not so distant place, in a galaxy much similar to our own we find ourselves delving into the “dark side” of things to engage students. Find out how a somewhat non-traditional approach to student and community engagement has lead to huge interest in the STEAM fields at [name removed]. This maker demonstration will showcase how utilizing a theme such as Star Wars creates a framework for student exploration into the maker field. We will present multiple maker components created by students to work both independently and to become part of a larger interactive display focused around a common theme. Each maker piece will have accompanying instructions on how to design and build it; as well as we will be providing the larger framework guidelines to be able to replicate such an interactive display in a variety of academic programs (K-12 to college). This approach allows for students’ personalized learning on their own maker project while bringing into view the bigger picture of the needs for design specifications and the utilization of skills outside their traditional areas of study. The maker components include Arduinos, LEDs, stepper motors, 3D printed objects, etc. Thus begins a new hope for STEAM. It is a period of academic unrest as we venture to the dark side and bring about a period of personalized engagement. Help us in our battle to win against the “SAGE ON THE STAGE” and their power to destroy an entire learning experience. USE THE FORCE of ENGAGEMENT to make a new future for STEAM.","Pitcher, Mike Thomas;Espinoza, Pedro Arturo;Hector Erick Lugo Nevarez;Gomez, Hugo;Anaya, Randy Hazael;Hemmitt, Herminia;Perez, Oscar Antonio;Golding, Peter;Pruneda, Alfonso;Soto, Sara;Lopez, Erik;Paquian, Gil, Jr",10.18260/p.25613,ProQuest
"""Finding the Joy in the Unknown"": Implementation of STEAM Teaching Practices in Middle School Science and Math Classrooms","In response to a desire to strengthen the economy, educational settings are emphasizing science, technology, engineering, and mathematics (STEM) curriculum and programs. Yet, because of the narrow approach to STEM, educational leaders continue to call for a more balanced approach to teaching and learning, which includes the arts, design, and humanities. This desire created space for science, technology, engineering, arts, and mathematics (STEAM) education, a transdisciplinary approach that focuses on problem-solving. STEAM-based curricula and STEAM-themed schools are appearing all over the globe. This growing national and global attention to STEAM provides an opportunity for teacher education to explore the ways in which teachers implement STEAM practices, examining the successes and challenges, and how teachers are beginning to make sense of this innovative teaching practice. The purpose of this paper is to examine the implementation of STEAM teaching practices in science and math middle school classrooms, in hopes to provide research-based evidence on this emerging topic to guide teacher educators.","Quigley, Cassie F.;Herro, Dani",10.1007/s10956-016-9602-z,ProQuest
Global root zone storage capacity from satellite-based evaporation,"This study presents an “Earth observation-based” method for estimating root zone storage capacity – a critical, yet uncertain parameter in hydrological and land surface modelling. By assuming that vegetation optimises its root zone storage capacity to bridge critical dry periods, we were able to use state-of-the-art satellite-based evaporation data computed with independent energy balance equations to derive gridded root zone storage capacity at global scale. This approach does not require soil or vegetation information, is model independent, and is in principle scale independent. In contrast to a traditional look-up table approach, our method captures the variability in root zone storage capacity within land cover types, including in rainforests where direct measurements of root depths otherwise are scarce. Implementing the estimated root zone storage capacity in the global hydrological model STEAM (Simple Terrestrial Evaporation to Atmosphere Model) improved evaporation simulation overall, and in particular during the least evaporating months in sub-humid to humid regions with moderate to high seasonality. Our results suggest that several forest types are able to create a large storage to buffer for severe droughts (with a very long return period), in contrast to, for example, savannahs and woody savannahs (medium length return period), as well as grasslands, shrublands, and croplands (very short return period). The presented method to estimate root zone storage capacity eliminates the need for poor resolution soil and rooting depth data that form a limitation for achieving progress in the global land surface modelling community.","Wang-Erlandsson, Lan;Bastiaanssen, Wim G M;Gao, Hongkai;Jägermeyr, Jonas;Senay, Gabriel B;Albert I J M van Dijk;Guerschman, Juan P;Keys, Patrick W;Gordon, Line J;Savenije, Hubert H G",10.5194/hess-20-1459-2016,ProQuest
Dancing with STEAM: Creative Movement Generates Electricity for Young Learners,"The integration of science, technology, engineering, arts, and mathematics (STEAM) serves to develop creative thinking and twenty-first-century skills in the classroom (Maeda 2012). Learning through STEAM promotes novelty, innovation, ingenuity, and task-specific purposefulness to solve real-world problems--all aspects that define creativity. Lisa Fanning is a fifth-grade teacher at a public elementary school with school-wide arts integration at the core of its vision. Fanning participated in a district-wide professional development project through which she partnered with a dance teaching artist. Together with her partner, she engaged in a 12-hour workshop to develop common understandings about curricular intersections, practiced co-teaching structures, and devised essential questions to guide their lesson planning. They subsequently engaged in 24 hours of additional professional development during a summer institute to learn specific methodology in dance integration, including elements, strategies, and facilitation techniques. During the summer institute, Jamie Simpson Steele (a performing arts specialist) and Lori Fulton (a science educator) provided a framework for thinking about STEAM intersections and examples of art and science integrated experiences for teachers and teaching artists. Next, Fanning and her teaching artist partner co-planned and co-taught a semester-long inquiry to investigate this question: How does energy transform? This inquiry engaged students in hands-on activities, field-based experiences, interviews with experts, science notebooks, creative movement improvisation, dance choreography, and a call for social activism. The collaborations consisted of ten sessions of planning time and ten co-taught lessons in the classroom. Fanning's unit focused on the properties of wind and how its energy could be stored, transformed, and transferred for use. The science objective required students to describe how later when they engineered turbines). To explore the relationship among the earth, sea, and sky, students connected to their personal experiences at the beach and did further observation and research. Students converted these ideas into a model by expanding, rising, and pushing their bodies through space. Finally, students responded to the work of their peers, practicing artistic thinking by observing, describing, and interpreting each other's movements (Harris 2013). The unit culminated in a public performance with invited parents and community members. During this sharing, students performed original choreography, exhibited wind turbines, led station activities to inform their guests about the wind as a source of energy, and engaged in a mock demonstration advocating for renewable energy.","Simpson Steele, Jamie;Fulton, Lori;Fanning, Lisa",10.1080/15290824.2016.1175570,ProQuest
Changing the World for Good: Tech Trek Alabama Changes 8th Grade Girls’ Attitudes Towards STEM,"Changing the World for Good: Tech Trek Alabama Changes 8th Grade Girls’ Attitudes Towards STEM The American Association of University Women (AAUW) research report ”Why SoFew? Women in Science, Technology, Engineering, and Mathematics (STEM)” found thatwomen are vastly underrepresented in STEM majors and fields compared with their male peers.But “Why So Few?” also showed that those numbers can change when girls realize theirpotential in STEM at an early age. In 2012, AAUW decided to provide girls across the countrythe opportunity to immerse themselves in hands-on exploration of STEM topics in order toencourage them to take more advanced STEM classes in high school and go on to major inSTEM fields in college. Using the model developed in California, AAUW brought Tech Trek, aweeklong summer camp for rising eighth-grade girls that is designed to develop interest,excitement, and self-confidence in STEM through classes, workshops, hands-on activities, andfield trips to four national sites in 2013.The inaugural Alabama Tech Trek camp, a partnership between the local AAUW branch andInstitution was held July 20-25, 2014. The girls spent 17.5 hours in core classes, choosing fromrobotics, app development, and life science. They also gained exposure to additional areas ofSTEM through workshops, a field trip, and evening activities. Technical workshops includedinstant challenges conducted by trained evaluators from Destination Imagination, rocket buildingand the engineering design process led by NASA Education, and DNA extraction at the HudsonAlpha Institute for Biotechnology. Non-technical presentations included communicating your bigidea, STEAM, and stress release. The campers also toured a prototyping facility at Dynetics, Inc.and took the Ultimate Math Field Trip challenge at the US Space and Rocket Center. Thehighlight of the week was the Professional Women’s Night, an event that involved professionalsrotating among groups of girls, speed dating style.Significant Findings: The number of girls strongly agreeing with the statement “I plan to takeadvanced science and math courses in high school” went from 34 in the pre-camp survey to 39 inthe post-camp survey, an increase of 14.7 %. The number of girls strongly agreeing with thestatement “I’m thinking of having a career in science or technology” went from 24 in the pre-camp survey to 38 in the post-camp survey, an increase of 58.3 %.","Gaede, Rhonda Kay",10.18260/p.23683,ProQuest
Educate Utilizing CubeSat Experience: Unified K-20 Vision of Comprehensive STEAM-Powered Space Systems Education Program,"Educate Utilizing CubeSat Experience: Unified K-20 Vision of Comprehensive STEAM-Powered Space Systems Education ProgramEducate Utilizing CubeSat Experience (EdUCE) debuted in 2010 as a K-20 Science,Technology, Engineering, and Mathematics (STEM) education program using space-derivedactivities with an emphasis on design and development of CubeSats. CubeSats originallywere introduced to train and expose university students and faculty to holistic spacecraftresearch and development. Recently, the inclusion of the Arts (resulting in STEAM) hasbecome a complementary effort to engage students/educators in activities and to motivateinnovation in Systems Engineering curriculum. This paper discusses a new systematicapproach which (i) utilizes a Backward Design approach to develop coherent end-to-endsystem engineering content and (ii) delivers this content through state-of-the-art digitalplatforms. Specifically, the following hypothesis-driven questions are investigated: • How does the design of the EdUCE program meet STEAM standards and expectations? • How is Systems Engineering (in particular design and development of CubeSats) correlated to the Backward Design approach that is adopted in educational curriculum? • How to use the arts to complement the understanding of STEM concepts with a focus on Systems Engineering? • How are digital platforms (i.e., interactive books, Web 2.0 and mobile apps) paired with hands-on activities an effective mechanism to enable learning? • What best practices have been targeted and implemented for dissemination of EdUCE?Backward Design approach is a tool used in elementary and secondary education to developcurricula and teaching lessons which involves the following phases: (1) determination of thelearning outcomes, (2) development of the assessments, and (3) design of the learningexperience; essentially, the process has the end in mind by first, identify the learning goals,next identify the metrics required to measure success, then finally design/implement thelearning activities to meet these goals, thus creating a systematic path. The SystemsEngineering process shares lots of parallelisms with Backward Design; it begins with a need(i.e., objective), assesses alternatives and designs and develops products and activities (i.e.,verification and validation, operations, sustainment, and retirement) to satisfy the need in asystematic way.Via this approach, educators and techinical subject matter experts collaborate in thedevelopment process and manage age appropriate curriculum, thus unifying and broadeningboth the number and quality of K-20 participants worldwide. To demonstrate, an example ofengaging curriculum is presented. The end-to-end design and development process and thelife experiences from a CubeSat program are the major contributing factors in engaging theparticipants, however, complementary space activities, such as microgravity experiments,high altitude balloon experiments, and CanSats are included. Additionally, this is integratedwith the use of digital platforms to increase the awareness and the emphasis on STEAM.","Shiotani, Bungo;Buckley, Dante Augustus;Bumbaco, Amy Elizabeth;Fitz-Coy, Norman G",10.18260/p.23905,ProQuest
