The Culture of Disciplines: Reconceptualising Multi-Subject Curricula,"The arts are recognised for their potential to humanise and enrich educational experience, but hold a lowly position in the hierarchy of school subject-based curricula. This limits the time, and thus the influence, they can have. Whilst schools welcome the idea of a curriculum rich with both arts and science subjects, resistance to realising this is often advanced in terms of the proportion of curriculum time required for different subjects. Arguments for STEAM education, whilst apparently challenging this and valuing the potential of the arts, have reinforced its servant role. Drawing on research into a particular project, where the perspectives of the arts and sciences inform and enrich how the other is experienced and understood, we reframe this problem. Firstly, drawing on Massey's conception of space-time, we argue that one can conceive of more than one subject occupying the same curricular space on a school timetable. Secondly, informed by Geertz, we consider what the culture of the arts and the sciences offers, suggesting that this appears to reflect what teachers have valued. We argue that foregrounding the culture of school subjects, and particularly the culture of the arts, as part of a multicultural frame can facilitate rich and engaging educational experiences. Rather than being positioned as competing for time or status in the curriculum, a focus on culture emphasises how the co-existence and interplay of multiple subjects broadens, develops and thus enriches children's educational experience. It also enables a different conception of, and thus role for, the arts in schooling.",True,No,4. Duplication,,2595832570,EJ1311798,,Scholarly Journals,,"Davies, Richard;Trowsdale, Jo",,,,,,10.1002/berj.3735,"Report , Article",,,2021,,0141-1926,5,English,English,,1434-1446,,2021,British Educational Research Journal,"Scholarly Journals , Reports",2021.0,https://www.wiley.com/en-us,"ERIC, © Wiley",47,https://www.proquest.com/scholarly-journals/culture-disciplines-reconceptualising-multi/docview/2595832570/se-2?accountid=14480,,,,,,,,1434,,"10280ER3 3205ER3 10236ER1 3192ER1 , 633ER3 3205ER3 633ER1 3192ER1 , 2517ER3 5216ER3 2513ER1 5194ER1",,,https://libkey.io/libraries/1768/openurl?genre=article&amp;au=Davies%2C+Richard%3BTrowsdale%2C+Jo&amp;aulast=Davies&amp;issn=01411926&amp;isbn=&amp;title=The+Culture+of+Disciplines%3A+Reconceptualising+Multi-Subject+Curricula&amp;jtitle=British+Educational+Research+Journal&amp;pubname=British+Educational+Research+Journal&amp;btitle=&amp;atitle=The+Culture+of+Disciplines%3A+Reconceptualising+Multi-Subject+Curricula&amp;volume=47&amp;issue=5&amp;spage=1434&amp;date=2021&amp;doi=10.1002%2Fberj.3735&amp;sid=ProQuest,ERIC
The Emerging Critical Pedagogies of Dance Educators in an Urban STEAM After-School Program for Black Girls,"The preparation of urban educators has gained widespread attention across education policy, research, and practice. As US urban cities have become more diverse, the teacher workforce has not kept up, and the racial/ethnic demographics of students and teachers are disproportionately incongruent. In order to eradicate an education landscape that perpetuates white, middle-class ways of knowing and being, often at the expense of the cultural practices and cultural wealth of historically marginalized students of color, urban teacher education must be centered toward justice and rooted in critical pedagogies. The literature, albeit bleak, reveals that these perspectives must also be applied to urban dance education. Dance education programs have been significantly eliminated from urban schools over time, and although dance has historical roots in African and African diasporic cultures, dance education continues to be Eurocentric. This phenomenological case study examines the emerging critical pedagogies of undergraduate dance majors and minors who served as dance teachers in an urban Science, Technology, Engineering, Arts, and Mathematics (STEAM) after-school program for 7-12-year-old Black girls. Findings reveal that (a) navigating race, place, and space; (b) mentorship and practice; and (c) critical reflection and self-efficacy were critical components of the urban dance educators' emerging critical pedagogies. Implications for urban dance education and the broader field of urban education are provided.",True,No,4. Duplication,,2540364212,EJ1294470,,Scholarly Journals,,"Allen-Handy, Ayana;Ifill, Valerie;Schaar, Raja Y.;Woodard, Monique;Rogers, Michelle",,,U215N160055,,,,"Report , Article",2766-497X,,2021,,,1,English,English,,58-88,,2021,"Journal of Urban Learning, Teaching, and Research","Scholarly Journals , Reports",2021.0,http://jultr.online/index.php/jultr,"ERIC, © AERA SIG: Urban Learning",16,https://www.proquest.com/scholarly-journals/emerging-critical-pedagogies-dance-educators/docview/2540364212/se-2?accountid=14480,,,,,"Higher Education , Postsecondary Education",,,58,,"2464ER3 11018ER3 2460ER1 9925ER1 8947ER1 10966ER1 , 8687ER3 7975ER3 5140ER3 8648ER1 7940ER1 5118ER1 , 2534ER3 2527ER3 3205ER3 8921ER3 2530ER1 2523ER1 3192ER1 8882ER1 , 9942ER3 1586ER3 5724ER3 9899ER1 1586ER1 5700ER1 , 2600ER3 633ER3 3205ER3 2596ER1 633ER1 3192ER1 , 10280ER3 3205ER3 10236ER1 3192ER1 , 314ER3 8475ER3 314ER1 8438ER1 , 298ER3 7283ER3 8149ER3 4625ER3 298ER1 7250ER1 8114ER1 4605ER1 , 4002ER3 8149ER3 4625ER3 3987ER1 8114ER1 4605ER1 , 8222ER3 1491ER3 321ER3 8149ER3 4625ER3 8187ER1 1491ER1 321ER1 8114ER1 4605ER1 , 11286ER3 1831ER3 10457ER3 8149ER3 4625ER3 11231ER1 1829ER1 10411ER1 8114ER1 4605ER1 , 6654ER3 9171ER3 6868ER3 9812ER3 6691ER3 8149ER3 4625ER3 6626ER1 9130ER1 6838ER1 9769ER1 6663ER1 8114ER1 4605ER1 , 9622ER3 9625ER3 9607ER3 9581ER1 9584ER1 9566ER1 , 8870ER3 1734ER3 8831ER1 1733ER1 , 11358ER3 3205ER3 11303ER1 3192ER1","Higher Education , Postsecondary Education",,https://libkey.io/libraries/1768/openurl?genre=article&amp;au=Allen-Handy%2C+Ayana%3BIfill%2C+Valerie%3BSchaar%2C+Raja+Y.%3BWoodard%2C+Monique%3BRogers%2C+Michelle&amp;aulast=Allen-Handy&amp;issn=2766-497X&amp;isbn=&amp;title=The+Emerging+Critical+Pedagogies+of+Dance+Educators+in+an+Urban+STEAM+After-School+Program+for+Black+Girls&amp;jtitle=Journal+of+Urban+Learning%2C+Teaching%2C+and+Research&amp;pubname=Journal+of+Urban+Learning%2C+Teaching%2C+and+Research&amp;btitle=&amp;atitle=The+Emerging+Critical+Pedagogies+of+Dance+Educators+in+an+Urban+STEAM+After-School+Program+for+Black+Girls&amp;volume=16&amp;issue=1&amp;spage=58&amp;date=2021&amp;doi=&amp;sid=ProQuest,ERIC
The implementation results of safe bicycle transport in Taipei City,"Background: In 2013, there were 7,016 bicycle accidents, resulting in 62 deaths and 10,162 injuries in Taiwan. Since then, there have been more than 7,000 accidents every year, and the number of accidents in 2017 has reached a peak of 8,106 records for the past five years. Among them, the number of electric bicycle accidents increased the most, with 1,183 compared to 2013 and the number of persons injured also increased by 1,310 whereas the number of bicycle accident from 6,262 to 6,169. Methods: Taipei City creating a friendly, safe and secure urban environment to ride: 1. Bicycle Road Network Deployment: bicycle-exclusive lanes, walkways, bicycle and pedestrian shared path and so on in order to meet a variety of traffic needs. 2. Safe and comprehensive road environment: Set up bike stands, road surfacing, street trees, signs, (pavement) markings, dedicated signs, intersection rotation and other traffic amenities to create a safe and comfortable riding environment. To promote cycling to the station to transfer MRTs is tantamount to encouraging people to take more public transport. 3. Planning a city bicycle rental system: To provide a public rental system to expand the convenience, visibility and the community of users launched a new type of public transport - public bicycle rental system (YouBike). The Youbike started demonstration operation, initially setting up 11 station points and 500 bicycles in the peripheral regions of Xinyi District on March 1 1th, 2009, and now there are 400 station points in all districts. 4. Bicycle Safe Riding Education: Most people refuse to wear helmet protection, and do not install safety devices such as reflectors and warning lights. Causes easy collision at night. The top three reasons for bicycle accidents are not giving way according to regulations, inappropriately making U-turns (turn direction) and Breaching traffic signs and sign controls. Furthermore, wrong-way driving and Careless overstepping are also the main causes of accidents. 5. Smart transportation Setting: To build a safe environment from the appropriate space. Its city area cycle path from 41 kilometers in 2006 (16.4 for dedicated lanes and 24.6 for bicycle and pedestrian shared path) to an extended 391 kilometers in 2018 (86.7 kilometers for dedicated lanes and 304.3 for bicycle and pedestrian shared path). The number of bike stands in Taipei urban area has increased from 5,202 in 2006 to 42,121 in 2018(809%). Appropriately adjust the lane allocation ratio through management means and let the left-turning bicycle turn in a two-stage left turn. This way allows the bicycle to start earlier than the steam locomotive when the green light starts to light up. Results: The implementation results of safe bicycle transport in Taipei City effectively reduced the death and rate caused by head injuries in bicycle accidents: the number of casualties (6,262 dropped to 6,169, down 1.49%), the number of deaths (59 to 30, a drop of 49.15%) or the number of injured persons (9,099 to 8,71 1), all presented a declining trend. Conclusion: Changing car-oriented road planning, complete bicycle infrastructure, and respecting the driving awareness of bicycle users is the best protection for the public. All policies should have comprehensive safety policies to ensure personal safety. Just like separate two types of transport, the overall design of the exclusive separation bicycle road, the policy of forcing all ages riding locomotives to wear helmets, etc. In the future, we will continue to plan for self-defense special road layout, intersection ramp configuration, traffic engineering and parking and transfer facilities, so that all roads in the city are safe and friendly, and we will become the first place for bicycle safety riding. Successful experience is extended to the whole country.",True,No,4. Duplication,,2419451888,,,Scholarly Journals,"Xinyi Safety and Health Association, Taipei City, Taiwan (Province of China) , Xinyi District Health Center, Taipei City, Taiwan (Province of China) , Xinyi District Health Center, Taipei City, Taiwan (Province of China) , Xinyi District Health Center, Taipei City, Taiwan (Province of China) , Xinyi District Health Center, Taipei City, Taiwan (Province of China)","Wu, Yin-Huan;Ching-Ting, Yang;Chen-Chen, Chou;Man-Lin, Chang;Ming-Yu, Hsieh;Yeh-Tzu, Kuo",,,,"© 2019. This work is published under https://creativecommons.org/licenses/by/3.0/ (the “License”). Notwithstanding the ProQuest Terms and Conditions, you may use this content in accordance with the terms of the License.",,,Journal Article,,,2019-07-01 00:00:00,,2008-2053,,English,English,,2023-02-01 00:00:00,Kermanshah,2019-07-01 00:00:00,Journal of Injury and Violence Research,,2019.0,,,11,https://www.proquest.com/scholarly-journals/implementation-results-safe-bicycle-transport/docview/2419451888/se-2?accountid=14480,,,,,,,,1,,"Public transportation , Traffic accidents & safety , Roads & highways , Traffic control , Injuries , Bicycling , Taiwan",,,https://libkey.io/libraries/1768/openurl?genre=article&amp;au=Wu%2C+Yin-Huan%3BChing-Ting%2C+Yang%3BChen-Chen%2C+Chou%3BMan-Lin%2C+Chang%3BMing-Yu%2C+Hsieh%3BYeh-Tzu%2C+Kuo&amp;aulast=Wu&amp;issn=20082053&amp;isbn=&amp;title=The+implementation+results+of+safe+bicycle+transport+in+Taipei+City&amp;jtitle=Journal+of+Injury+and+Violence+Research&amp;pubname=Journal+of+Injury+and+Violence+Research&amp;btitle=&amp;atitle=The+implementation+results+of+safe+bicycle+transport+in+Taipei+City&amp;volume=11&amp;issue=&amp;spage=1&amp;date=2019&amp;doi=&amp;sid=ProQuest,Publicly Available Content Database
The potential of citizen science data to complement satellite and airborne lidar tree height measurements: lessons from The GLOBE Program,"The Global Learning and Observations to Benefit the Environment (GLOBE) Program is an international science, citizen science, and education program through which volunteers in participating countries collect environmental data in support of Earth system science. Using the program’s software application, GLOBE Observer (GO), volunteers measure tree height and optional tree circumference, which may support the interpretation of NASA and other space-based satellite data such as tree height data from the Ice, Cloud, and land Elevation Satellite-2 (ICESat-2) and Global Ecosystem Dynamics Investigation instrument. This paper describes tree heights data collected through the GO application and identifies sources of error in data collection. We also illustrate how the ground-based citizen science data collected in the GO application can be used in conjunction with ICESat-2 tree height observations from two locations in the United States: Grand Mesa, Colorado, and Greenbelt, Maryland. Initial analyses indicate that data location accuracy and the scientific relevance of data density should be considered in order to align GLOBE tree height data with satellite-based data collections. These recommendations are intended to inform the improved implementation of citizen science environmental data collection in scientific work and to document a use case of the GLOBE Trees data for the science research community.",True,No,4. Duplication,,2679297920,,,Scholarly Journals,"Department of Geoscience, Boise State University , Boise, ID, United States of America , Earth Sciences Division, NASA Goddard Space Flight Center , Greenbelt, MD, United States of America; Laboratory for Atmospheres, NASA Wallops Flight Facility , Wallops Island, VA, United States of America; Global Science and Technology, Inc. , Greenbelt, MD, United States of America , Earth Sciences Division, NASA Goddard Space Flight Center , Greenbelt, MD, United States of America; Science Systems and Applications, Inc. , Lanham, MD, United States of America , Department of Geoscience, Boise State University , Boise, ID, United States of America , Earth Sciences Division, NASA Goddard Space Flight Center , Greenbelt, MD, United States of America; Science Systems and Applications, Inc. , Lanham, MD, United States of America , Science Systems and Applications , Inc., Pasadena, CA, United States of America , Humanities and STEAM, Monsignor McClancy Memorial High School , Queens, NY, United States of America","Enterkine, Josh;Campbell, Brian A;Kohl, Holli;Glenn, Nancy F;Weaver, Kristen;Overoye, David;Danke, Deanna",,,,"© 2022 The Author(s). Published by IOP Publishing Ltd. This work is published under http://creativecommons.org/licenses/by/4.0 (the “License”). Notwithstanding the ProQuest Terms and Conditions, you may use this content in accordance with the terms of the License.",,10.1088/1748-9326/ac77a2,Journal Article,,,2022-07-01 00:00:00,,,7,English,English,,,Bristol,2022-07-01 00:00:00,Environmental Research Letters,,2022.0,,,17,https://www.proquest.com/scholarly-journals/potential-citizen-science-data-complement/docview/2679297920/se-2?accountid=14480,,,,,"citizen science , ICESat-2 , NASA GLOBE Observer , tree height , The GLOBE Program , carbon storage",,"2022-05-17 (revised) , 2021-12-10 (received) , 2022-06-10 (accepted) , 2022-05-18 (oa-requested)",75003,,"Data collection , Science , Ecosystem dynamics , Observational learning , Elevation , Data collection , Lidar , Data collection , Ecosystem dynamics , Satellites , Trees , Data collection , Airborne sensing","citizen science , ICESat-2 , NASA GLOBE Observer , tree height , The GLOBE Program , carbon storage",,https://libkey.io/libraries/1768/openurl?genre=article&amp;au=Enterkine%2C+Josh%3BCampbell%2C+Brian+A%3BKohl%2C+Holli%3BGlenn%2C+Nancy+F%3BWeaver%2C+Kristen%3BOveroye%2C+David%3BDanke%2C+Deanna&amp;aulast=Enterkine&amp;issn=&amp;isbn=&amp;title=The+potential+of+citizen+science+data+to+complement+satellite+and+airborne+lidar+tree+height+measurements%3A+lessons+from+The+GLOBE+Program&amp;jtitle=Environmental+Research+Letters&amp;pubname=Environmental+Research+Letters&amp;btitle=&amp;atitle=The+potential+of+citizen+science+data+to+complement+satellite+and+airborne+lidar+tree+height+measurements%3A+lessons+from+The+GLOBE+Program&amp;volume=17&amp;issue=7&amp;spage=075003&amp;date=2022&amp;doi=10.1088%2F1748-9326%2Fac77a2&amp;sid=ProQuest,Publicly Available Content Database
"UMES STEM Faculty, Students, and Staff Collaborate to Address Contemporary Issues Related to Energy, Environment, and Sustainable Agriculture","UMES STEM FACULTY, STUDENTS, AND STAFF COLLABORATE TO ADDRESS CONTEMPORARY ISSUES RELATED TO ENERGY, ENVIRONMENT, AND SUSTAINABLE AGRICULTUREAbstract“The Bio-Fuel, Sustainability, and Geospatial Information Technologies to Enhance ExperientialLearning Paradigm for Precision Agriculture Project”, recently funded by the United StatesDepartment of Agriculture (USDA) extends the environmental stewardship archetype of thepreceding project titled “Environmentally Conscious Precision Agriculture: A Platform for ActiveLearning and Community Engagement” (completed in September 2011). The initial phase of theproject to demonstrate the production of biodiesel using waste vegetable oil (WVO) from campusdining services has been successfully executed by UMES student team. Under the supervision ofthe project leaders, the students have worked in teams to collect, dewater, and filter the WVO;supported the acquisition of supplies and installation of the biodiesel processor; performednecessary titration and laboratory tests on the WVO to determine appropriate amounts ofchemicals ( sodium hydroxide, methanol, and sulfuric acid) to be used with a batch of WVO inthe processor for the esterification and transesterification reactions; and operated and monitoredthe 48 hour biodiesel production and washing cycle of the processor. Besides biodiesel theprocess produces glycerin as byproduct. The glycerin has been used to produce soap successfullyby the students. Students have also tested ‘gelling’ tendency of different blends of biodiesel andare currently working with the UMES farm manager to identify and appropriately modify farmequipment for biodiesel use. Students are also working with the university safety office to refinesafety considerations to comply with OSHA and municipality requirements. Students will beinvolved in managing broader logistics of scheduling the processor operation for biodieselproduction and utilization, based on needs of the farm equipment. The project team plans torefine the processing of glycerin by-product to improve the aesthetics, fragrance, and otherqualitative parameters of the soap so that they may sell it for possible fund-raising efforts forselected student organizations.The project leaders have encouraged all “STEAM” (science, technology, engineering, agriculture,and mathematics) majors to participate in the ongoing efforts and are exploring involvement ofinterested business, human ecology, and fine-arts students to address some of the new dimensionsof the project. Maryland Space Grant Consortium has provided supplementary support forinterested undergraduate students, particularly from the underserved population to get involved.The broader scope of the project includes use of biodiesel, a carbon neutral energy source, for usewith farm equipment and as an alternative transportation fuel to address climate change andsustainable energy related issues. Furthermore, the project will continue to address use of remotesensing and advanced geospatial information technology tools to optimize use of nutrients, water,and other resources for efficient production agriculture practices that are critical to provide foodfor a growing population on the planet in a sustainable fashion.",True,No,4. Duplication,,2317777436,,,Conference Papers & Proceedings,,"Nagchaudhuri, Abhijit;Mitra, Madhumi;Teays, Terry John;Daughtry, Craig S T;Schwarz, Jurgen G;Marsh, Lurline",,,,"© 2012. Notwithstanding the ProQuest Terms and Conditions, you may use this content in accordance with the associated terms available at https://peer.asee.org/about .",,,Conference Proceedings,,2015-07-06,2012-06-10 00:00:00,,,,English,English,,25.1383.1-25.1383.8,Atlanta,2012-06-10 00:00:00,Association for Engineering Education - Engineering Library Division Papers,,2012.0,,,,https://www.proquest.com/conference-papers-proceedings/umes-stem-faculty-students-staff-collaborate/docview/2317777436/se-2?accountid=14480,,,,,,,,25.1383.1,,"Fuels , Students , Biodiesel fuels , Sulfuric acid , Consortia , Collaboration , Microprocessors , Technology utilization , Esterification , Laboratory tests , Technical education , Agriculture , Renewable energy , Byproducts , Gelation , Ecological monitoring , Agricultural practices , Climate change , Sodium hydroxide , Students , Agricultural equipment , Agricultural engineering , Nutrients , Environmental stewardship , Community participation , Logistics , Farm machinery , Titration , Biodiesel fuels",,https://peer.asee.org/umes-stem-faculty-students-and-staff-collaborate-to-address-contemporary-issues-related-to-energy-environment-and-sustainable-agriculture,https://libkey.io/libraries/1768/openurl?genre=proceeding&amp;au=Nagchaudhuri%2C+Abhijit%3BMitra%2C+Madhumi%3BTeays%2C+Terry+John%3BDaughtry%2C+Craig+S+T%3BSchwarz%2C+Jurgen+G%3BMarsh%2C+Lurline&amp;aulast=Nagchaudhuri&amp;issn=&amp;isbn=&amp;title=UMES+STEM+Faculty%2C+Students%2C+and+Staff+Collaborate+to+Address+Contemporary+Issues+Related+to+Energy%2C+Environment%2C+and+Sustainable+Agriculture&amp;jtitle=Association+for+Engineering+Education+-+Engineering+Library+Division+Papers&amp;pubname=Association+for+Engineering+Education+-+Engineering+Library+Division+Papers&amp;btitle=&amp;atitle=UMES+STEM+Faculty%2C+Students%2C+and+Staff+Collaborate+to+Address+Contemporary+Issues+Related+to+Energy%2C+Environment%2C+and+Sustainable+Agriculture&amp;volume=&amp;issue=&amp;spage=25.1383.1&amp;date=2012&amp;doi=&amp;sid=ProQuest,Publicly Available Content Database
