Optimizing the preparation of Ni‐Ce‐Pr catalysts for efficient hydrogen production by n‐dodecane steam reforming,"Nowadays, the development of fuel cell is getting more and more inseparable from the production of hydrogen. Long‐chain hydrocarbons steam reforming is a feasible way for hydrogen supply. Herein, various nickel‐ceria‐praseodymium (Ni‐Ce‐Pr) catalysts have been prepared by a sol‐gel method. Multiple parameters during catalyst preparation, including the amount of Ni, the content of doped Pr and the calcination temperature, were systematically studied for tuning the catalytic performance for n ‐dodecane steam reforming in a fixed‐bed reactor under 15 mL/g cat ·h at 600°C and water‐to‐carbon molar ratio of 2 at 0.1 MPa. Reaction data showed that both the amount of Ni and the content of doped Pr will greatly affect the n ‐dodecane conversion and hydrogen production. Additionally, the calcination temperature during catalyst preparation showed a big influence on its performance for n ‐dodecane steam reforming. After optimization, 10Ni‐CePr 2 ‐600 exhibits the highest activity and stability for n ‐dodecane steam reforming, accompanying with the lowest rate of coke deposition (0.015 g c /g cat ·h). The structure and oxygen vacancy of the catalyst was characterized by H 2 ‐TPR, Raman, and X‐ray photoelectron spectroscopy (XPS). The superior activity and stability of 10Ni‐CePr 2 ‐600 are ascribed to the strong interaction between NiO and support along with abundant oxygen vacancies in the Pr‐doped ceria.",False,No,1. Space related,,2354588197,,,Scholarly Journals,"Key Laboratory for Green Chemical Technology of Ministry of Education, School of Chemical Engineering and Technology, Tianjin University, Tianjin, China , Key Laboratory for Green Chemical Technology of Ministry of Education, School of Chemical Engineering and Technology, Tianjin University, Tianjin, China; Collaborative Innovation Center of Chemical Science and Engineering (Tianjin), Tianjin, China , Key Laboratory for Green Chemical Technology of Ministry of Education, School of Chemical Engineering and Technology, Tianjin University, Tianjin, China; Collaborative Innovation Center of Chemical Science and Engineering (Tianjin), Tianjin, China , Key Laboratory for Green Chemical Technology of Ministry of Education, School of Chemical Engineering and Technology, Tianjin University, Tianjin, China; Collaborative Innovation Center of Chemical Science and Engineering (Tianjin), Tianjin, China","Xiao, Zhourong;Zhang, Xiangwen;Wang, Li;Li, Guozhu",,,,"© 2020 John Wiley & Sons, Ltd.",,10.1002/er.5029,Journal Article,,2019-12-05,2020-03-01 00:00:00,,0363-907X,3,English,English,,1828-1842,Bognor Regis,2020-03-01 00:00:00,International Journal of Energy Research,,2020.0,,,44,https://www.proquest.com/scholarly-journals/optimizing-preparation-ni-ce-pr-catalysts/docview/2354588197/se-2?accountid=14480,,,,,"n ‐dodecane , Ni , oxygen vacancy , Pr doped ceria , steam reforming",,"2019-09-05 (Received) , 2019-10-31 (Revised) , 2019-11-16 (Accepted)",1828,,"Praseodymium , Hydrogen production , Nickel , Nickel , Praseodymium , Hydrogen , Dodecane , Reforming , Nickel , Catalysts , Temperature , Catalysts , Hydrogen , Temperature , Hydrocarbons , Nuclear fuels , Vacancies , Photoelectrons , Fuel cells , Steam , Fuel technology , Sol-gel processes , Optimization , Steam , Stability , Cerium oxides , Nickel , X ray photoelectron spectroscopy , Optimization , Catalysts , Dodecane , Stability , Strong interactions (field theory) , Hydrogen , Gels , Hydrogen , Photoelectron spectroscopy , Roasting , Oxygen , Oxygen , Catalysts , Analytical methods","n ‐dodecane , Ni , oxygen vacancy , Pr doped ceria , steam reforming",,https://libkey.io/libraries/1768/openurl?genre=article&amp;au=Xiao%2C+Zhourong%3BZhang%2C+Xiangwen%3BWang%2C+Li%3BLi%2C+Guozhu&amp;aulast=Xiao&amp;issn=0363907X&amp;isbn=&amp;title=Optimizing+the+preparation+of+Ni%E2%80%90Ce%E2%80%90Pr+catalysts+for+efficient+hydrogen+production+by+n%E2%80%90dodecane+steam+reforming&amp;jtitle=International+Journal+of+Energy+Research&amp;pubname=International+Journal+of+Energy+Research&amp;btitle=&amp;atitle=Optimizing+the+preparation+of+Ni%E2%80%90Ce%E2%80%90Pr+catalysts+for+efficient+hydrogen+production+by+n%E2%80%90dodecane+steam+reforming&amp;volume=44&amp;issue=3&amp;spage=1828&amp;date=2020&amp;doi=10.1002%2Fer.5029&amp;sid=ProQuest,Publicly Available Content Database
Pencil‐traced‐graphite on cellulose: A rapid and solvent‐less approach for solar steam generation,"Solar steam generation has proven to be a sustainable method to handle water shortage. Various materials for solar steam generation have been introduced in the past few years. However, the utilization of tedious and complicated synthesis to generate a photoactive layer is a matter of concern in the fabrication solar steam generation devices. Thus, improved methods toward cost‐effectiveness by exploring economical materials with simple manufacturing process are urgently and essentially needed. In this study, we first report on manufacturing hybrid membranes using commercially accessible materials, that is, cellulose paper and pencil graphite. The proposed method is to trace and coat a cellulose paper directly with a pencil without the use of solvents and chemicals, and it is possible to create an ecofriendly photoactive layer without a complicated process. The formed pencil graphite‐traced membranes were successfully utilized in solar steam generation and showed excellent steam generation rate of 4.32 kg/m 2 h which is almost 3.5 times more than that of pristine membrane at solar intensity of 3 Sun. The developed method could be widely utilized in the field of solar steam generation, since it is very facile and simple, and can be integrated to other commonly used materials for solar steam generation such as fabric and wood. In addition, on‐site production is possible, so it has a potential to be utilized in remote and resource‐limited areas for steam generation.",False,No,1. Space related,,2501869811,,,Scholarly Journals,"School of Mechanical Engineering, Korea University of Technology and Education, Cheonan, South Korea; Advanced Technology Research Center, Korea University of Technology and Education, Cheonan, South Korea; Future Convergence Engineering, Korea University of Technology and Education, Cheonan, South Korea , School of Mechanical Engineering, Korea University of Technology and Education, Cheonan, South Korea; Advanced Technology Research Center, Korea University of Technology and Education, Cheonan, South Korea , School of Mechanical Engineering, Korea University of Technology and Education, Cheonan, South Korea , Department of Mechanical Engineering (integrated Engineering), Kyung Hee University, Yongin, South Korea , School of Mechanical Engineering, Korea University of Technology and Education, Cheonan, South Korea; Advanced Technology Research Center, Korea University of Technology and Education, Cheonan, South Korea; Future Convergence Engineering, Korea University of Technology and Education, Cheonan, South Korea","Muhammad Zakria Tariq;Hanif, Zahid;La, Moonwoo;Choi, Dongwhi;Sung Jea Park",,,,"© 2021 John Wiley & Sons, Ltd.",,10.1002/er.6219,Journal Article,,,2021-03-01 00:00:00,,0363-907X,4,English,English,,6395-6404,Bognor Regis,2021-03-01 00:00:00,International Journal of Energy Research,,2021.0,,,45,https://www.proquest.com/scholarly-journals/pencil-traced-graphite-on-cellulose-rapid-solvent/docview/2501869811/se-2?accountid=14480,,,,,"cellulose , paper , pencil graphite , photothermal , solvent‐less , steam generation",,"2020-10-27 (Revised) , 2020-08-26 (Received) , 2020-10-31 (Accepted)",6395,,"Cellulose , Graphite , Solvents , Graphite , Graphite , Fabrication , Cellulose , Materials , Cellulose , Steam , Water shortages , Solvents , Manufacturing industry , Graphite , Solvents , Steam generation , Membranes , Membranes , Cellulose , Cellulose , Uses","cellulose , paper , pencil graphite , photothermal , solvent‐less , steam generation",,https://libkey.io/libraries/1768/openurl?genre=article&amp;au=Muhammad+Zakria+Tariq%3BHanif%2C+Zahid%3BLa%2C+Moonwoo%3BChoi%2C+Dongwhi%3BSung+Jea+Park&amp;aulast=Muhammad+Zakria+Tariq&amp;issn=0363907X&amp;isbn=&amp;title=Pencil%E2%80%90traced%E2%80%90graphite+on+cellulose%3A+A+rapid+and+solvent%E2%80%90less+approach+for+solar+steam+generation&amp;jtitle=International+Journal+of+Energy+Research&amp;pubname=International+Journal+of+Energy+Research&amp;btitle=&amp;atitle=Pencil%E2%80%90traced%E2%80%90graphite+on+cellulose%3A+A+rapid+and+solvent%E2%80%90less+approach+for+solar+steam+generation&amp;volume=45&amp;issue=4&amp;spage=6395&amp;date=2021&amp;doi=10.1002%2Fer.6219&amp;sid=ProQuest,Publicly Available Content Database
Performance improvement of drysteam geothermal power plant by employing bottoming binary system,"This study examines on how to improve the performance of dry-steam geothermal power plants in Kamojang by utilizing the binary system. The main data taken in this research is the temperature, pressure and mass flow collected from the plant’s operational data. It is then analyzed using the thermodynamic method and Engineering Equation Solver (EES). Results from the analysis showed that the net power output is about 48,865 kW. The first law efficiency increases from 16.45% to 19.44%, while the second law efficiency increases from 18.69% to 28.75%.",False,No,1. Space related,,2557632884,,,Scholarly Journals,"Mechanical Engineering Education, Sebelas Maret University, Jl. Ir. Sutami 36A, Surakarta 57126, Indonesia , Mechanical Engineering Education, Sebelas Maret University, Jl. Ir. Sutami 36A, Surakarta 57126, Indonesia , Mechanical Engineering Education, Sebelas Maret University, Jl. Ir. Sutami 36A, Surakarta 57126, Indonesia , Lee Kong Chian Faculty of Engineering and Science, UTAR, Selangor, 43000, Malaysia , Department of Energy Systems Engineering, Technology Faculty, Fırat University, 23100 Elazig, Turkey , Graduate School of Engineering and Resource Science, Akita University, Akita, Japan","Nova Dany Setyawan;Pambudi, Nugroho Agung;Utomo, Frandhoni;Saw, Lip Huat;Gürtürk, Mert;Saeid Mohammadzadeh Bina",,,,"© 2019. This work is published under http://creativecommons.org/licenses/by/3.0/ (the “License”). Notwithstanding the ProQuest Terms and Conditions, you may use this content in accordance with the terms of the License.",,10.1088/1755-1315/249/1/012022,Journal Article,,2019-04-12,2019-03-01 00:00:00,,1755-1307,1,English,English,,,Bristol,2019-03-01 00:00:00,IOP Conference Series. Earth and Environmental Science,,2019.0,,,249,https://www.proquest.com/scholarly-journals/performance-improvement-drysteam-geothermal-power/docview/2557632884/se-2?accountid=14480,,,,,,,2019-03-01 (openaccess),,,"Power plants , Mass flow , Performance enhancement , Power plants , Geothermal power , Binary system , Geothermal energy , Steam electric power generation , Geothermal power , Geothermal power plants",,,https://libkey.io/libraries/1768/openurl?genre=article&amp;au=Nova+Dany+Setyawan%3BPambudi%2C+Nugroho+Agung%3BUtomo%2C+Frandhoni%3BSaw%2C+Lip+Huat%3BG%C3%BCrt%C3%BCrk%2C+Mert%3BSaeid+Mohammadzadeh+Bina&amp;aulast=Nova+Dany+Setyawan&amp;issn=17551307&amp;isbn=&amp;title=Performance+improvement+of+drysteam+geothermal+power+plant+by+employing+bottoming+binary+system&amp;jtitle=IOP+Conference+Series.+Earth+and+Environmental+Science&amp;pubname=IOP+Conference+Series.+Earth+and+Environmental+Science&amp;btitle=&amp;atitle=Performance+improvement+of+drysteam+geothermal+power+plant+by+employing+bottoming+binary+system&amp;volume=249&amp;issue=1&amp;spage=&amp;date=2019&amp;doi=10.1088%2F1755-1315%2F249%2F1%2F012022&amp;sid=ProQuest,Publicly Available Content Database
"Physical Education as a Subject in France (School Curriculum, Policies and Discourse): The Body and the Metaphors of the Engine -- Elements Used in the Analysis of a Power and Control System during the Second Industrial Revolution","An analysis of several works by people who contributed greatly to the development of physical education in France from the middle of the 19th century to the 1960s enables us to pinpoint the rules underlying the specialized language used in this field & the metaphorical & mythological systems that were set up as systems of control over the body. Among these images, it is particularly interesting to examine how ""man"" came to be seen in terms of a steam engine, then as a machine, & even more generally as a humanized form of ""productivity."". 86 References. Adapted from the source document.",False,No,1. Space related,,60426161,200218367,,Scholarly Journals,,"Gleyse, J;Pigeassou, C;Marcellini, A;De Leseleuc, E;Bui-Xuan, G",,,,,"Gleyse, J",10.1080/13573320120113549,Journal Article,,,2002-03-01 00:00:00,,1357-3322,1,English,English,,5-23,,2002-03-01 00:00:00,"Sport, Education and Society",CSAPTjournals,2002.0,United Kingdom,,7,https://www.proquest.com/scholarly-journals/physical-education-as-subject-france-school/docview/60426161/se-2?accountid=14480,"Sport, Education and Society, vol. 7, no. 1, pp. 5-23, Mar 2002",1432 sociology of education; sociology of education,1432 sociology of education; sociology of education,,,1432 sociology of education; sociology of education,,5,1432 sociology of education; sociology of education,"Physical Education , France , Curriculum , Discourse , Human Body , Metaphors",article,,https://libkey.io/libraries/1768/openurl?genre=article&amp;au=Gleyse%2C+J%3BPigeassou%2C+C%3BMarcellini%2C+A%3BDe+Leseleuc%2C+E%3BBui-Xuan%2C+G&amp;aulast=Gleyse&amp;issn=13573322&amp;isbn=&amp;title=Physical+Education+as+a+Subject+in+France+%28School+Curriculum%2C+Policies+and+Discourse%29%3A+The+Body+and+the+Metaphors+of+the+Engine+--+Elements+Used+in+the+Analysis+of+a+Power+and+Control+System+during+the+Second+Industrial+Revolution&amp;jtitle=Sport%2C+Education+and+Society&amp;pubname=Sport%2C+Education+and+Society&amp;btitle=&amp;atitle=Physical+Education+as+a+Subject+in+France+%28School+Curriculum%2C+Policies+and+Discourse%29%3A+The+Body+and+the+Metaphors+of+the+Engine+--+Elements+Used+in+the+Analysis+of+a+Power+and+Control+System+during+the+Second+Industrial+Revolution&amp;volume=7&amp;issue=1&amp;spage=5&amp;date=2002&amp;doi=10.1080%2F13573320120113549&amp;sid=ProQuest,Sociological Abstracts
"Playing, Debugging, Learning: A Proposal between Game and Instructional Designs via Extended Prototyping","This article investigates the phenomenon of open and participative development (e.g. beta testing, Kickstarter projects)--i.e. extended prototyping--in digital entertainment as a potential source of insights for instructional interventions. Despite the increasing popularity of this practice and the potential implications for educators and instructional designers, little efforts have been done in enlightening the topic. This study aims to address this lack by staging a bridge between Instructional Design and Game Design with an empirical inquiry. N:130 subjects (beta testers and Steam Early Access and Kickstarter users) were recruited with a quantitative questionnaire about their contribution to open development instances. Behavioral patterns, effective policies and managements, and subjective profiles and opinions were gathered and tied to instructional design models and concepts. Results point to successful techniques in designing and applying such a process, while mistakes and unproductive tactics are highlighted as well. To summarize, instruction can take advantage of an increased participation of targeted audiences/learners to its development phases. Benefits span transparency, engagement, and commitment. However, poor communication and incoherence between testing and final product may weaken the overall outcome.",False,No,1. Space related,,2024001272,EJ1170202,,Scholarly Journals,,"Gandolfi, Enrico",,,,,,10.1177/2042753018757079,"Article , Report , Undefined , 080: Journal Articles , 143: Reports - Research , 160: Tests/Questionnaires",2042-7530,,2018-03-01 00:00:00,,,2,English,English,,67-92,,2018-03-01 00:00:00,E-Learning and Digital Media,"Scholarly Journals , Reports , Other Sources",2018.0,http://sagepub.com,"ERIC, © SAGE Publications",15,https://www.proquest.com/scholarly-journals/playing-debugging-learning-proposal-between-game/docview/2024001272/se-2?accountid=14480,,,,,"United States , United Kingdom , Italy , Canada , Germany , Netherlands , Denmark , Switzerland , Sweden , India , Greece , Hungary , France , Malaysia , Norway",,,67,,"3324ER3 10854ER3 3311ER1 10805ER1 , 10860ER3 10811ER1 , 5335ER3 2805ER3 5313ER1 2799ER1 , 4347ER3 128ER3 4328ER1 128ER1 , 10253ER3 2608ER3 3693ER3 6691ER3 10210ER1 2604ER1 3679ER1 6663ER1 , 8681ER3 6555ER3 8642ER1 6527ER1 , 921ER3 921ER1 , 8103ER3 8068ER1 , 5140ER3 5118ER1 , 738ER3 6555ER3 738ER1 6527ER1 , 8240ER3 740ER3 8204ER1 740ER1 , 6171ER3 738ER3 6555ER3 8750ER3 6144ER1 738ER1 6527ER1 8711ER1 , 4185ER3 4414ER3 4166ER1 4394ER1 , 229ER3 321ER3 8149ER3 4625ER3 229ER1 321ER1 8114ER1 4605ER1 , United States , United Kingdom , Italy , Canada , Germany , Netherlands , Denmark , Switzerland , Sweden , India , Greece , Hungary , France , Malaysia , Norway","United States , United Kingdom , Italy , Canada , Germany , Netherlands , Denmark , Switzerland , Sweden , India , Greece , Hungary , France , Malaysia , Norway",,https://libkey.io/libraries/1768/openurl?genre=article&amp;au=Gandolfi%2C+Enrico&amp;aulast=Gandolfi&amp;issn=2042-7530&amp;isbn=&amp;title=Playing%2C+Debugging%2C+Learning%3A+A+Proposal+between+Game+and+Instructional+Designs+via+Extended+Prototyping&amp;jtitle=E-Learning+and+Digital+Media&amp;pubname=E-Learning+and+Digital+Media&amp;btitle=&amp;atitle=Playing%2C+Debugging%2C+Learning%3A+A+Proposal+between+Game+and+Instructional+Designs+via+Extended+Prototyping&amp;volume=15&amp;issue=2&amp;spage=67&amp;date=2018&amp;doi=10.1177%2F2042753018757079&amp;sid=ProQuest,ERIC
Relational Epistemologies in Land-Based Learning Environments: Reasoning about Ecological Systems and Spatial Indexing in Motion,"Social and cultural practices in learning settings are sites for leveraging and/or remediating sustainable and just conceptions of nature-culture relations to meet changing environmental demands of twenty-first century. In this study,&#xa0;we examine epistemic navigation among Indigenous youth in an outdoor, land based, STEAM (science, education, arts, math, and science) camp which not only leveraged nature-culture relations as part of critical engagement with socio-ecological systems, but also as a site for Indigenous resurgence and well-being in learning spaces. We&#xa0;take a microethnographic (Gee and Green in Rev Res Educ 23:119-169, 1998. https://doi.org/10.2307/1167289) approach&#xa0;to examine sense-making among three youth while engaged in a walking activity in which they were asked to embody a plant as part of cultural practices of reading the land. We found that the micro-practice of spatial indexing dynamically mediated sense-making about ecological systems as participants coordinated attention and observations between humans and more-than-human kinds. This form of sense making reflected both cultural and historical experiences, which students leveraged in their understandings of complex socio-ecological systems.",False,No,1. Space related,,2461125838,EJ1218517,,Scholarly Journals,,"Pugh, Priya;McGinty, Megan;Bang, Megan",,,,,,10.1007/s11422-019-09922-1,"Report , Article",,,2019,,1871-1502,2,English,English,,425-448,,2019,Cultural Studies of Science Education,"Scholarly Journals , Reports",2019.0,https://link.springer.com/,"ERIC, © Springer",14,https://www.proquest.com/scholarly-journals/relational-epistemologies-land-based-learning/docview/2461125838/se-2?accountid=14480,,,,,,,,425,,"3601ER3 7939ER3 5006ER3 6069ER3 3587ER1 7904ER1 4985ER1 6042ER1 , 5135ER3 8149ER3 4625ER3 5113ER1 8114ER1 4605ER1 , 7587ER3 3205ER3 7553ER1 3192ER1 , 3584ER3 3205ER3 3570ER1 3192ER1 , 10280ER3 3205ER3 10236ER1 3192ER1 , 633ER3 3205ER3 633ER1 3192ER1 , 10078ER3 2ER3 10035ER1 2ER1 , 3166ER3 1006ER3 7097ER3 9507ER3 6069ER3 3153ER1 1006ER1 7065ER1 9466ER1 6042ER1",,,https://libkey.io/libraries/1768/openurl?genre=article&amp;au=Pugh%2C+Priya%3BMcGinty%2C+Megan%3BBang%2C+Megan&amp;aulast=Pugh&amp;issn=18711502&amp;isbn=&amp;title=Relational+Epistemologies+in+Land-Based+Learning+Environments%3A+Reasoning+about+Ecological+Systems+and+Spatial+Indexing+in+Motion&amp;jtitle=Cultural+Studies+of+Science+Education&amp;pubname=Cultural+Studies+of+Science+Education&amp;btitle=&amp;atitle=Relational+Epistemologies+in+Land-Based+Learning+Environments%3A+Reasoning+about+Ecological+Systems+and+Spatial+Indexing+in+Motion&amp;volume=14&amp;issue=2&amp;spage=425&amp;date=2019&amp;doi=10.1007%2Fs11422-019-09922-1&amp;sid=ProQuest,ERIC
Restoring a Classic Electric Car,"One hundred years ago, automobiles were powered by steam, electricity, or internal combustion. Female drivers favored electric cars because, unlike early internal-combustion vehicles, they did not require a crank for starting. Nonetheless, internal-combustion vehicles came to dominate the industry and it's only in recent years that the electrics have gotten more attention. In this article, the author describes how he restored a 1981 Mercury Lynx that had been converted by Jet Industries to function as a plug-in electric vehicle.",False,No,1. Space related,,1322244708,EJ994493,,Scholarly Journals,,"Kraft, Thomas E.",,,,,,,"Article , Report , 080: Journal Articles , 141: Reports - Descriptive",,,2012-03-01 00:00:00,,1062-9351,8,English,English,,19-21,,2012-03-01 00:00:00,Tech Directions,"Scholarly Journals , Reports",2012.0,http://www.techdirections.com/,"ERIC, © Prakken Publications",71,https://www.proquest.com/scholarly-journals/restoring-classic-electric-car/docview/1322244708/se-2?accountid=14480,,,,,,,,19,,"6952ER3 3616ER3 6922ER1 3602ER1 , 828ER3 6569ER3 10854ER3 828ER1 6541ER1 10805ER1 , 3523ER3 9510ER3 3509ER1 9469ER1 , 2318ER3 2315ER1 , 10855ER3 3205ER3 10806ER1 3192ER1",,,https://libkey.io/libraries/1768/openurl?genre=article&amp;au=Kraft%2C+Thomas+E.&amp;aulast=Kraft&amp;issn=10629351&amp;isbn=&amp;title=Restoring+a+Classic+Electric+Car&amp;jtitle=Tech+Directions&amp;pubname=Tech+Directions&amp;btitle=&amp;atitle=Restoring+a+Classic+Electric+Car&amp;volume=71&amp;issue=8&amp;spage=19&amp;date=2012&amp;doi=&amp;sid=ProQuest,ERIC
