"Celestial calendar-paintings and culture-based digital storytelling: cross-cultural, interdisciplinary, STEM/STEAM resources for authentic astronomy education engagement","In D(L)akota star knowledge, the Sun is known as Wi and the Moon is Han-Wi. They have an important relationship, husband and wife. The pattern of their ever-changing relationship is mirrored in the motions of Sun and Moon as seen from our backyards, also called the lunar phases. The framework of the cultural teaching is storytelling and relationships. Cultural perspectives in astronomy such as this remind us of how indigenous ways of knowing are rooted in inclusion, engagement, and relevancy. Designed by A. Lee in 2007, the Native Skywatchers initiative seeks to remember and revitalize indigenous star and earth knowledge, promoting the native voice as the lead voice. The overarching goal of Native Skywatchers is to communicate the knowledge that indigenous people traditionally practiced a sustainable way of living and sustainable engineering through a living and participatory relationship with the above and below, sky and earth. In 2012 two indigenous star maps were created: the Ojibwe Giizhig Anung Masinaaigan-Ojibwe Sky Star Map (A. Lee, W. Wilson, C. Gawboy), and the D(L)akota star map, Makoce Wicanhpi Wowapi (A. Lee, J. Rock). In 2016, a collaboration with W. Buck of the Manitoba First Nations Resource Centre (MFNRC), produced a third star map: Ininew Achakos Masinikan-Cree Star Map Book. We aim to improve current inequities in education for native young people especially through STEM engagement, to inspire increased cultural pride, and promote community wellness. Presented here will be recently created resources such as: astronomical calendar-paintings and short videos that exist at the intersection of art-science-culture. As we look for sustainable ways to widen participation in STEM, particularly in astronomy education, part of the conversation needs to consider the place for art and culture in STEM.",True,No,4. Duplication,,2435344463,,,Working Papers,,"Lee, Annette S;Wilson, William;Tibbetts, Jeff;Gawboy, Carl;Meyer, Anne;Buck, Wilfred;Knutson-Kolodzne, Jim;Pantalony, David",,,,"© 2020. This work is published under http://arxiv.org/licenses/nonexclusive-distrib/1.0/ (the “License”). Notwithstanding the ProQuest Terms and Conditions, you may use this content in accordance with the terms of the License.",,,Working Paper,,2020-08-19,2020-08-18 00:00:00,,,,English,English,,,Ithaca,2020-08-18 00:00:00,arXiv.org,,2020.0,,,,https://www.proquest.com/working-papers/celestial-calendar-paintings-culture-based/docview/2435344463/se-2?accountid=14480,,,,,"Physics Education , History and Philosophy of Physics , Physics and Society",,"arXiv.org , 2020-08-18 (Submission v1)",,,"Lunar phases , Regeneration , Moon , Culture , Astronomy , Culture , Astronomy , Star maps , Stars & galaxies , Young adults , Technical education , Indigenous peoples , Voice communication , Maps , Celestial bodies","Physics Education , History and Philosophy of Physics , Physics and Society",http://arxiv.org/abs/2008.07716,https://libkey.io/libraries/1768/openurl?genre=preprint&amp;au=Lee%2C+Annette+S%3BWilson%2C+William%3BTibbetts%2C+Jeff%3BGawboy%2C+Carl%3BMeyer%2C+Anne%3BBuck%2C+Wilfred%3BKnutson-Kolodzne%2C+Jim%3BPantalony%2C+David&amp;aulast=Lee&amp;issn=&amp;isbn=&amp;title=Celestial+calendar-paintings+and+culture-based+digital+storytelling%3A+cross-cultural%2C+interdisciplinary%2C+STEM%2FSTEAM+resources+for+authentic+astronomy+education+engagement&amp;jtitle=arXiv.org&amp;pubname=arXiv.org&amp;btitle=&amp;atitle=Celestial+calendar-paintings+and+culture-based+digital+storytelling%3A+cross-cultural%2C+interdisciplinary%2C+STEM%2FSTEAM+resources+for+authentic+astronomy+education+engagement&amp;volume=&amp;issue=&amp;spage=&amp;date=2020&amp;doi=&amp;sid=ProQuest,Publicly Available Content Database
"Celestial calendar-paintings and culture-based digital storytelling: cross-cultural, interdisciplinary, STEM/STEAM resources for authentic astronomy education engagement","In D(L)akota star knowledge, the Sun is known as Wi and the Moon is Han-Wi . They have an important relationship, husband and wife. The pattern of their ever-changing relationship is mirrored in the motions of Sun and Moon as seen from our backyards, also called the lunar phases. The framework of the cultural teaching is storytelling and relationships. Cultural perspectives in astronomy such as this remind us of how indigenous ways of knowing are rooted in inclusion, engagement, and relevancy. Designed by A. Lee in 2007, the Native Skywatchers initiative seeks to remember and revitalize indigenous star and earth knowledge, promoting the native voice as the lead voice. The overarching goal of Native Skywatchers is to communicate the knowledge that indigenous people traditionally practiced a sustainable way of living and sustainable engineering through a living and participatory relationship with the above and below, sky and earth. In 2012 two indigenous star maps were created: the Ojibwe Giizhig Anung Masinaaigan -Ojibwe Sky Star Map (A. Lee, W. Wilson, C. Gawboy), and the D(L)akota star map, Makoce Wicanhpi Wowapi (A. Lee, J. Rock). In 2016, a collaboration with W. Buck of the Manitoba First Nations Resource Centre (MFNRC), produced a third star map: Ininew Achakos Masinikan - Cree Star Map Book. We aim to improve current inequities in education for native young people especially through STEM engagement, to inspire increased cultural pride, and promote community wellness. Presented here will be recently created resources such as: astronomical calendar-paintings and short videos that exist at the intersection of art-science-culture. As we look for sustainable ways to widen participation in STEM, particularly in astronomy education, part of the conversation needs to consider the place for art and culture in STEM.",True,No,4. Duplication,,2174265270,,,Conference Papers & Proceedings,,"Lee, Annette S;Wilson, William;Tibbetts, Jeff;Gawboy, Cark;Meyer, Anne;Buck, Wilfred;Knutson-Kolodzne, Jim;Pantalony, David",,,,"© 2019. This work is licensed under http://creativecommons.org/licenses/by/4.0 (the “License”). Notwithstanding the ProQuest Terms and conditions, you may use this content in accordance with the terms of the License.",,10.1051/epjconf/201920001002,Conference Proceedings,,2019-02-01,2019,,2101-6275,,English,English,,,Les Ulis,2019,EPJ Web of Conferences,,2019.0,,,200,https://www.proquest.com/conference-papers-proceedings/celestial-calendar-paintings-culture-based/docview/2174265270/se-2?accountid=14480,,,,,,,,,,"Lunar phases , Moon , Regeneration , Culture , Young people , Astronomy , Culture , Astronomy , Star maps , Stars & galaxies , Voice communication , Technical education , Maps , Celestial bodies",,,https://libkey.io/libraries/1768/openurl?genre=proceeding&amp;au=Lee%2C+Annette+S%3BWilson%2C+William%3BTibbetts%2C+Jeff%3BGawboy%2C+Cark%3BMeyer%2C+Anne%3BBuck%2C+Wilfred%3BKnutson-Kolodzne%2C+Jim%3BPantalony%2C+David&amp;aulast=Lee&amp;issn=21016275&amp;isbn=&amp;title=Celestial+calendar-paintings+and+culture-based+digital+storytelling%3A+cross-cultural%2C+interdisciplinary%2C+STEM%2FSTEAM+resources+for+authentic+astronomy+education+engagement&amp;jtitle=EPJ+Web+of+Conferences&amp;pubname=EPJ+Web+of+Conferences&amp;btitle=&amp;atitle=Celestial+calendar-paintings+and+culture-based+digital+storytelling%3A+cross-cultural%2C+interdisciplinary%2C+STEM%2FSTEAM+resources+for+authentic+astronomy+education+engagement&amp;volume=200&amp;issue=&amp;spage=&amp;date=2019&amp;doi=10.1051%2Fepjconf%2F201920001002&amp;sid=ProQuest,Publicly Available Content Database
Changing the World for Good: Tech Trek Alabama Changes 8th Grade Girls’ Attitudes Towards STEM,"Changing the World for Good: Tech Trek Alabama Changes 8th Grade Girls’ Attitudes Towards STEM The American Association of University Women (AAUW) research report ”Why SoFew? Women in Science, Technology, Engineering, and Mathematics (STEM)” found thatwomen are vastly underrepresented in STEM majors and fields compared with their male peers.But “Why So Few?” also showed that those numbers can change when girls realize theirpotential in STEM at an early age. In 2012, AAUW decided to provide girls across the countrythe opportunity to immerse themselves in hands-on exploration of STEM topics in order toencourage them to take more advanced STEM classes in high school and go on to major inSTEM fields in college. Using the model developed in California, AAUW brought Tech Trek, aweeklong summer camp for rising eighth-grade girls that is designed to develop interest,excitement, and self-confidence in STEM through classes, workshops, hands-on activities, andfield trips to four national sites in 2013.The inaugural Alabama Tech Trek camp, a partnership between the local AAUW branch andInstitution was held July 20-25, 2014. The girls spent 17.5 hours in core classes, choosing fromrobotics, app development, and life science. They also gained exposure to additional areas ofSTEM through workshops, a field trip, and evening activities. Technical workshops includedinstant challenges conducted by trained evaluators from Destination Imagination, rocket buildingand the engineering design process led by NASA Education, and DNA extraction at the HudsonAlpha Institute for Biotechnology. Non-technical presentations included communicating your bigidea, STEAM, and stress release. The campers also toured a prototyping facility at Dynetics, Inc.and took the Ultimate Math Field Trip challenge at the US Space and Rocket Center. Thehighlight of the week was the Professional Women’s Night, an event that involved professionalsrotating among groups of girls, speed dating style.Significant Findings: The number of girls strongly agreeing with the statement “I plan to takeadvanced science and math courses in high school” went from 34 in the pre-camp survey to 39 inthe post-camp survey, an increase of 14.7 %. The number of girls strongly agreeing with thestatement “I’m thinking of having a career in science or technology” went from 24 in the pre-camp survey to 38 in the post-camp survey, an increase of 58.3 %.",True,No,4. Duplication,,2317751223,,,Conference Papers & Proceedings,,"Gaede, Rhonda Kay",,,,"© 2015. Notwithstanding the ProQuest Terms and Conditions, you may use this content in accordance with the associated terms available at https://peer.asee.org/about .",,10.18260/p.23683,Conference Proceedings,,2015-07-06,2015-06-14 00:00:00,,,,English,English,,26.344.1-26.344.12,Atlanta,2015-06-14 00:00:00,Association for Engineering Education - Engineering Library Division Papers,,2015.0,,,,https://www.proquest.com/conference-papers-proceedings/changing-world-good-tech-trek-alabama-changes-8th/docview/2317751223/se-2?accountid=14480,,,,,Diversity,,,26.344.1,,"Scientists , Workshops , Women , Design engineering , Field trips , Communication , Prototyping , Attitudes , Alabama",Diversity,https://peer.asee.org/changing-the-world-for-good-tech-trek-alabama-changes-8th-grade-girls-attitudes-towards-stem,https://libkey.io/libraries/1768/openurl?genre=proceeding&amp;au=Gaede%2C+Rhonda+Kay&amp;aulast=Gaede&amp;issn=&amp;isbn=&amp;title=Changing+the+World+for+Good%3A+Tech+Trek+Alabama+Changes+8th+Grade+Girls%E2%80%99+Attitudes+Towards+STEM&amp;jtitle=Association+for+Engineering+Education+-+Engineering+Library+Division+Papers&amp;pubname=Association+for+Engineering+Education+-+Engineering+Library+Division+Papers&amp;btitle=&amp;atitle=Changing+the+World+for+Good%3A+Tech+Trek+Alabama+Changes+8th+Grade+Girls%26rsquo%3B+Attitudes+Towards+STEM&amp;volume=&amp;issue=&amp;spage=26.344.1&amp;date=2015&amp;doi=10.18260%2Fp.23683&amp;sid=ProQuest,Publicly Available Content Database
"Chronicle of Higher Education. Volume 50, Number 30, April 2, 2004","""Chronicle of Higher Education"" presents an abundant source of news and information for college and university faculty members and administrators. This April 2, 2004 issue of ""Chronicle for Higher Education"" includes the following articles: (1) ""Black Colleges and the Politics of Race"" (Samuels, Albert L.); (2) ""The First Step on a Long March"" (Kluger Richard); (3) ""Do You Know What It Means to Find Peace in Queens?"" (Monaghan, Peter); (4) ""A Fascist Philosopher Helps Us Understand Contemporary Politics"" (Wolfe, Alan); (5) ""Who Should Pay the Bill for a Private Education?"" (Blaney, Dorothy); (6) ""Business Curricula Should Integrate Liberal-Arts and Vocational Skills"" (Sharpe, Norean Radke; Prichett, Gordon D.); (7) ""Now Is the Time to Start Studying the Internet Age"" (Cole, Jeffrey); (8) ""Thwarting Misbehavior in the Classroom"" (Perlmutter, David D.); (9) ""The Real Lessons of a 'Magnificent Mirage'"" (Bell, Derrick A.); (10) ""An Imperfect Desegregation"" (Clotfelter, Charles T.); (11) ""A New View of the Role of Courts"" (Cottrol, Robert J.; Diamond, Raymond T.; Ware, Leland B.); (12) ""Building a Road to a Diverse Society"" (Tatun, Beverly Daniel); (13) ""Your Player's Keeper"" (Marino, Gordon); (14) ""The Mommy Candidate: For a Would-Be-Law Professor, Going on the Job Market Means Weighing Career Moves Against Her Family's Happiness"" (Goode, Julia); (15) ""Remembering the Old Lions"" (Benton, Thomas); (16) ""Plus CA Change: The Trouble with Long-Range Planning Is That It Almost Never Works"" (Fish, Stanley); (17) ""Cracking Down in Taiwan"" (Lin-Liu, Jen); (18) ""Textbook Pirates Find a Huge Market in China: Foreign Publishers are Frustrated by a Lack of Government Cooperation, but Also Fear Being Shut Out of the Market"" (Lin-Liu, Jen); (19) ""Staggering Losses in Latin America: Public Indifference Allows Piracy to Flourish throughout the Region"" (Lloyd, Marion); (20) ""Publishers Battle Pirates in India with Little Success: Raids Produce Dozens of Arrests but No Convictions"" (Overland, Martha Ann); (21) ""Don't Steal this Book: Textbook Piracy Runs Rampant in Developing Countries, Costing Publishers--And Authors-Millions of Dollars"" (Bollag, Burton); (22) ""Courses in Computer Forensics Gain Popularity on Campuses"" (Carlson, Scott); (23) ""Prisoners in the Virtual Classroom: Technology Makes Inmate Education Cheaper, but the Programs Face Unusual Challenges"" (Carlson, Scott); (24) ""Member of Accrediting Group has Ph.D. from 'Notorious Diploma Mill'"" (Bartlett, Thomas); (25) ""Clean and Green Get Head of Steam: College Campuses Are Embracing Alternative Energy, and Student Activism is the Engine of Change"" (Meline, Megan); (26) ""Advocacy Groups Pressure Colleges to Disclose Affirmative-Action Policies"" (Schmidt, Peter); (27) ""Cultivating Colleges in New Jersey: After Years of Neglecting its Public Institutions, Can the Garden State Keep Its Students Home?"" (Arnone, Michael); (28) ""Goodbye, Little Green Men. Hello, Astrobiology: The Search for Extraterrestrials Spawns a Scientific Discipline That Is Gaining Respect"" (Monastersky, Richard); (29) ""Union Blues in the Sunshine State: Leaders of the U. of Florida Say Collective Bargaining Would Hamper the Institution's Bid for Excellence"" (Smallwood, Scott); (30) ""New Courses in the Cards"" (Arnone, Michael); and (31) ""Graduation Rates Called a Poor Measure of Colleges: Report Says Data Don't Give a True Picture of Success"" (Burd, Stephen).",True,No,4. Duplication,,61814310,EJ715046,,Other Sources,,,,,,,,,"Undefined , Article , 022: Collected Works - Serial , 080: Journal Articles",,,2004-04-01 00:00:00,,0009-5982,30,English,English,,,,2004-04-01 00:00:00,Chronicle of Higher Education,"Other Sources , Scholarly Journals",2004.0,http://chronicle.com,"ERIC, © Chronicle of Higher Education",50,https://www.proquest.com/other-sources/chronicle-higher-education-volume-50-number-30/docview/61814310/se-2?accountid=14480,,,,,"Higher Education , China , Florida , India , New Jersey , New York , Taiwan , Latin America , Teachers , Administrators",,,,,"298ER3 7283ER3 8149ER3 4625ER3 298ER1 7250ER1 8114ER1 4605ER1 , 1041ER3 291ER3 5330ER3 6833ER3 1839ER3 9461ER3 1041ER1 291ER1 5308ER1 6804ER1 1837ER1 9420ER1 , 8697ER3 9920ER3 8658ER1 9877ER1 , 4830ER3 8182ER3 3205ER3 4809ER1 8147ER1 3192ER1 , 8131ER3 8130ER3 8096ER1 8095ER1 , 8351ER3 1839ER3 9461ER3 5330ER3 8358ER3 8314ER1 1837ER1 9420ER1 5308ER1 8321ER1 , 7784ER3 7749ER1 , 1222ER3 11543ER3 3205ER3 1222ER1 11487ER1 3192ER1 , 6069ER3 6042ER1 , 11543ER3 3205ER3 11487ER1 3192ER1 , 5526ER3 2073ER3 7172ER3 5236ER3 5504ER1 2070ER1 7140ER1 5214ER1 , 10357ER3 921ER3 10311ER1 921ER1 , 1639ER3 3283ER3 6691ER3 1639ER1 3270ER1 6663ER1 , 9353ER3 9937ER3 9312ER1 9894ER1 , 2393ER3 2390ER1 , 2525ER3 2505ER3 2881ER3 2521ER1 2501ER1 2875ER1 , 11717ER3 3466ER3 4002ER3 8149ER3 4625ER3 3847ER3 8410ER3 3478ER3 5801ER3 4996ER3 9069ER3 9401ER3 11661ER1 3452ER1 3987ER1 8114ER1 4605ER1 3832ER1 8373ER1 3464ER1 5777ER1 4975ER1 9030ER1 9360ER1 , 6276ER3 8054ER3 6249ER1 8019ER1 , 4185ER3 4414ER3 4166ER1 4394ER1 , 10999ER3 1126ER3 8335ER3 8622ER3 5347ER3 3280ER3 10949ER1 1126ER1 8298ER1 8584ER1 5325ER1 3267ER1 , 2684ER3 2679ER1 , 8627ER3 5195ER3 1214ER3 8589ER1 5173ER1 1214ER1 , 2825ER3 4414ER3 2819ER1 4394ER1 , 2437ER3 552ER3 9901ER3 921ER3 2434ER1 552ER1 9858ER1 921ER1 , 2081ER3 5243ER3 9507ER3 6069ER3 2078ER1 5221ER1 9466ER1 6042ER1 , 11480ER3 1640ER3 3255ER3 3827ER3 2102ER3 2101ER3 10860ER3 11424ER1 1640ER1 3242ER1 3812ER1 2099ER1 2098ER1 10811ER1 , 2292ER3 3205ER3 2289ER1 3192ER1 , 3523ER3 9510ER3 3509ER1 9469ER1 , 3581ER3 3567ER1 , 127ER3 9901ER3 921ER3 127ER1 9858ER1 921ER1 , 92ER3 1394ER3 92ER1 1394ER1 , 254ER3 254ER1 , 276ER3 276ER1 , 8586ER3 1839ER3 9461ER3 5330ER3 8549ER1 1837ER1 9420ER1 5308ER1 , 702ER3 8000ER3 7097ER3 9507ER3 6069ER3 702ER1 7965ER1 7065ER1 9466ER1 6042ER1 , 1764ER3 1763ER1 , 4540ER3 5102ER3 4520ER1 5080ER1 , China , Florida , India , New Jersey , New York , Taiwan","Higher Education , China , Florida , India , New Jersey , New York , Taiwan , Latin America , Teachers , Administrators",,https://libkey.io/libraries/1768/openurl?genre=article&amp;au=&amp;aulast=&amp;issn=00095982&amp;isbn=&amp;title=Chronicle+of+Higher+Education.+Volume+50%2C+Number+30%2C+April+2%2C+2004&amp;jtitle=Chronicle+of+Higher+Education&amp;pubname=Chronicle+of+Higher+Education&amp;btitle=&amp;atitle=Chronicle+of+Higher+Education.+Volume+50%2C+Number+30%2C+April+2%2C+2004&amp;volume=50&amp;issue=30&amp;spage=&amp;date=2004&amp;doi=&amp;sid=ProQuest,ERIC
Curriculum Exchange: “The Art of Engineering”: a Four-Year Project-Based High School Curriculum,"Curriculum Exchange: “The Art of Engineering”: a Four-Year Project- Based High School CurriculumA teacher who is the recipient of a MacArthur Foundation Fellowship is implementing a newfour-year project-based STEAM curriculum. The program is designed to give students a real-world, interdisciplinary, project-based approach to learning. The program strives to create abalance between theory and application.The course sequence includes the following dedicated classes: • 9th Grade: Engineering Technology • 10th Grade: Engineering Sculpture and Design • 11th Grade: Engineering Physics • 12th Grade: Advanced Engineering Physics and FIRST Robotics (double-length class)All classes use project-based learning, i.e., the use of classroom projects to facilitate learning andassess student competence. This instructional method provides students with complex tasksbased on challenging questions or problems that involve the students’ problem-solving, decision-making, and investigative skills. Students develop valuable research and design skills. Project-based learning promotes new learning habits that emphasize creative thinking.During their first three years of study, 100 students per grade are enrolled in an integratedproject-based curriculum that collectively covers, in an interdisciplinary fashion, the contentcontained in 1) a standard laboratory science physics course, 2) a standard visual and performingarts sculpture course, and 3) an engineering elective course. These courses are taught by a teamof five teachers, who are credentialed in physics, visual and performing arts, and engineeringtechnology. Content is covered in a completely integrated, interdisciplinary fashion. Thesequence provides credit for a year each of physical science, visual arts, and an elective.Two projects will be presented here: 1) Students construct a hanging mobile. The sculpture has multiple moving parts and is colored to enhance the form. Elements and principles of design include line, shape, color, movement, balance, and space. Students use tools associated with engineering technology such as calipers, and electronic balances. Students calculate the force of gravity acting on each object and calculate all necessary torques and forces for balance. Students fabricate fasteners that allow elements of the mobile to be adjusted during assembly. 2) Students build a programmable light sculpture. The sculpture has a metal housing that is fabricated by the students. The sculpture consists of acrylic rods, which are machined by the students and then mounted in the housing. Students will use soldering irons, build a DC circuit board and wire the components together. The rods are lighted in color from below. The housing contains an Arduino computer that controls the timing and color changes of the sculpture. The students use the open-source Arduino platform to program their light sculpture.",True,No,4. Duplication,,2317862123,,,Conference Papers & Proceedings,,"Sandra Hull Seale;Abo-Shaeer, Amir Muhsin",,,,"© 2013. Notwithstanding the ProQuest Terms and Conditions, you may use this content in accordance with the associated terms available at https://peer.asee.org/about .",,,Conference Proceedings,,2015-07-02,2013-06-23 00:00:00,,,,English,English,,23.359.1-23.359.7,Atlanta,2013-06-23 00:00:00,Association for Engineering Education - Engineering Library Division Papers,,2013.0,,,,https://www.proquest.com/conference-papers-proceedings/curriculum-exchange-art-engineering-four-year/docview/2317862123/se-2?accountid=14480,,,,,,,,23.359.1,,"Students , Exchanging , Mathematical analysis , Skills , Interdisciplinary aspects , Curricula , Housing , Circuits , Color , Core curriculum , Decision making , Problem solving , Students , Rods , Calipers , Robotics , Physics , Learning , Automation , Fasteners , Teachers , Soldering , Engineering , Manufacturing engineering , Learning , Sculpture , Performing arts , Soldering irons",,https://peer.asee.org/curriculum-exchange-the-art-of-engineering-a-four-year-project-based-high-school-curriculum,https://libkey.io/libraries/1768/openurl?genre=proceeding&amp;au=Sandra+Hull+Seale%3BAbo-Shaeer%2C+Amir+Muhsin&amp;aulast=Sandra+Hull+Seale&amp;issn=&amp;isbn=&amp;title=Curriculum+Exchange%3A+%E2%80%9CThe+Art+of+Engineering%E2%80%9D%3A+a+Four-Year+Project-Based+High+School+Curriculum&amp;jtitle=Association+for+Engineering+Education+-+Engineering+Library+Division+Papers&amp;pubname=Association+for+Engineering+Education+-+Engineering+Library+Division+Papers&amp;btitle=&amp;atitle=Curriculum+Exchange%3A+%26ldquo%3BThe+Art+of+Engineering%26rdquo%3B%3A+a+Four-Year+Project-Based+High+School+Curriculum&amp;volume=&amp;issue=&amp;spage=23.359.1&amp;date=2013&amp;doi=&amp;sid=ProQuest,Publicly Available Content Database
