Title,Abstract,Already evaluated in previous cycle,Selection,Selection criteria violation,Flagged to read later,StoreId,AccessionNumber,AlternateTitle,ArticleType,AuthorAffiliation,Authors,coden,companies,contractNumber,copyright,correspondenceAuthor,digitalObjectIdentifier,documentType,elecISSN,elecPubDate,entryDate,isbn,issn,issue,language,languageOfSummary,originalTitle,pages,placeOfPublication,pubdate,pubtitle,publicationType,year,publisher,sourceAttrib,volume,DocumentURL,britishNursingIndexEdition,classification,classificationCodes,documentFeatures,identifierKeywords,majorClassificationCodes,notes,startPage,subjectClassifications,subjectTerms,subjects,URL,FindACopy,Database
"""From Atoms to Stars"": An Interactive Theatre Play Based on 'The Little Prince' Novella to Describe Spatial Thinking","The implementation of theatre as a didactic tool for teaching science provides a new perspective on the importance of interdisciplinary approaches in the construction of meaningful learning experiences. Gamification and collaborative work are functional strategies to teach scientific concepts in a creative way. However, there are still conceptual issues about spatial thinking that are difficult for students to understand owing to the lack of visualization of objects and their development through a characteristic chronicle. Here we show an innovative way to unifying science, technology, engineering, arts and mathematics (STEAM) careers through the development of an interactive theatrical play inspired by ""The Little Prince"" novella, to promote a culture of integration of science, theatre and literature. One of the more significant findings to emerge from this study is that the didactic strategies used are key ingredients in order to design an unique theatre play based on a link between history of atomic models and literature towards full understanding of spatial macroscales and microscales thinking. Due to the successful in the qualitative assessment results, we are devising to continue exploring the use of these didactic strategies to achieve an integrated and greater impact on students' learning processes.",False,Yes,,,2861162486,EJ1354857,,Scholarly Journals,,"Acuña-Umaña, K.;Gómez-Quirós, Carla;Herrera-Sancho, Oscar Andrey",,,,,,10.1088/1361-6552/ac6eb5,"Report , Article",,,2022,,0031-9120,4,English,English,,,,2022,Physics Education,"Scholarly Journals , Reports",2022.0,https://iopscience.iop.org/journal/0031-9120,"ERIC, © IOP Publishing",54,https://www.proquest.com/scholarly-journals/atoms-stars-interactive-theatre-play-based-on/docview/2861162486/se-2?accountid=14480,,,,,"Higher Education , Postsecondary Education , High Schools , Secondary Education",,,,,"10805ER3 3283ER3 6691ER3 10756ER1 3270ER1 6663ER1 , 9493ER3 5331ER3 9452ER1 5309ER1 , 11006ER3 4079ER3 5006ER3 6069ER3 10956ER1 4062ER1 4985ER1 6042ER1 , 5458ER3 6691ER3 5436ER1 6663ER1 , 9510ER3 9469ER1 , 4344ER3 5980ER3 4325ER1 5956ER1 , 11516ER3 1734ER3 11460ER1 1733ER1 , 6225ER3 5006ER3 6069ER3 6198ER1 4985ER1 6042ER1 , 2110ER3 6006ER3 1734ER3 2107ER1 5981ER1 1733ER1 , 4858ER3 5006ER3 6069ER3 9969ER3 9507ER3 4837ER1 4985ER1 6042ER1 9926ER1 9466ER1 , 7305ER3 8013ER3 8000ER3 7097ER3 9507ER3 6069ER3 7272ER1 7978ER1 7965ER1 7065ER1 9466ER1 6042ER1 , 10078ER3 2ER3 10035ER1 2ER1 , 6006ER3 1734ER3 5981ER1 1733ER1 , 7295ER3 4016ER3 8515ER3 6225ER3 5006ER3 6069ER3 6218ER3 7262ER1 4001ER1 8478ER1 6198ER1 4985ER1 6042ER1 6191ER1 , 3935ER3 3920ER1 , 11286ER3 1831ER3 10457ER3 8149ER3 4625ER3 11231ER1 1829ER1 10411ER1 8114ER1 4605ER1 , 4824ER3 9575ER3 10457ER3 8149ER3 4625ER3 4803ER1 9534ER1 10411ER1 8114ER1 4605ER1 , 4185ER3 4414ER3 4166ER1 4394ER1 , 2255ER3 5980ER3 2252ER1 5956ER1 , Costa Rica","Higher Education , Postsecondary Education , High Schools , Secondary Education",,https://libkey.io/libraries/1768/openurl?genre=article&amp;au=Acu%C3%B1a-Uma%C3%B1a%2C+K.%3BG%C3%B3mez-Quir%C3%B3s%2C+Carla%3BHerrera-Sancho%2C+Oscar+Andrey&amp;aulast=Acu%C3%B1a-Uma%C3%B1a&amp;issn=00319120&amp;isbn=&amp;title=%22From+Atoms+to+Stars%22%3A+An+Interactive+Theatre+Play+Based+on+%27The+Little+Prince%27+Novella+to+Describe+Spatial+Thinking&amp;jtitle=Physics+Education&amp;pubname=Physics+Education&amp;btitle=&amp;atitle=%26quot%3BFrom+Atoms+to+Stars%26quot%3B%3A+An+Interactive+Theatre+Play+Based+on+%27The+Little+Prince%27+Novella+to+Describe+Spatial+Thinking&amp;volume=54&amp;issue=4&amp;spage=&amp;date=2022&amp;doi=10.1088%2F1361-6552%2Fac6eb5&amp;sid=ProQuest,ERIC
The STEAM Innovation Laboratory: Beyond the Makerspace Paradigm,"The NASA Goddard STEAM Innovation Laboratory is a Makerspace approach to bringing NASA's universe of knowledge into educational spaces around the country and to increase scientific literacy and interest in STEAM careers. Through a series of stations specializing in virtual reality, electronics, mobile sensors and 3-D fabrication, we have succeeded in impacting over 82,000 educators and students, along with 1.6 million social media participants. Our impact analysis reveals that participants gain a lasting knowledge of our STEAM content from this hands-on experience.",False,Yes,,,2488225499,EJ1270051,,Scholarly Journals,,"Cline, Troy;Odenwald, Sten;Davis, Hilarie;Stephenson, Bryan;Mirel, Paul;Boyer, Kyle;Sasser, Lani",,,,,,,"Report , Article",,,2020,,0731-9258,4,English,English,,291-313,,2020,Journal of Computers in Mathematics and Science Teaching,"Scholarly Journals , Reports",2020.0,http://www.aace.org,"ERIC, © Association for the Advancement of Computing in Education",39,https://www.proquest.com/scholarly-journals/steam-innovation-laboratory-beyond-makerspace/docview/2488225499/se-2?accountid=14480,,,,,,,,291,,"633ER3 3205ER3 633ER1 3192ER1 , 10280ER3 3205ER3 10236ER1 3192ER1 , 9499ER3 8475ER3 9458ER1 8438ER1 , 8443ER3 8406ER1 , 9471ER3 128ER3 9430ER1 128ER1 , 8585ER3 324ER3 7547ER3 4625ER3 8548ER1 324ER1 7513ER1 4605ER1 , 3757ER3 5980ER3 3743ER1 5956ER1 , 3271ER3 5277ER3 3258ER1 5255ER1 , 7258ER3 8475ER3 7225ER1 8438ER1 , 7599ER3 8475ER3 7565ER1 8438ER1 , Maryland , United States--US",,,https://libkey.io/libraries/1768/openurl?genre=article&amp;au=Cline%2C+Troy%3BOdenwald%2C+Sten%3BDavis%2C+Hilarie%3BStephenson%2C+Bryan%3BMirel%2C+Paul%3BBoyer%2C+Kyle%3BSasser%2C+Lani&amp;aulast=Cline&amp;issn=07319258&amp;isbn=&amp;title=The+STEAM+Innovation+Laboratory%3A+Beyond+the+Makerspace+Paradigm&amp;jtitle=Journal+of+Computers+in+Mathematics+and+Science+Teaching&amp;pubname=Journal+of+Computers+in+Mathematics+and+Science+Teaching&amp;btitle=&amp;atitle=The+STEAM+Innovation+Laboratory%3A+Beyond+the+Makerspace+Paradigm&amp;volume=39&amp;issue=4&amp;spage=291&amp;date=2020&amp;doi=&amp;sid=ProQuest,ERIC
21st Century Community Learning Centers: A Descriptive Evaluation for 2012-2013,"This evaluation study provides descriptive information about the implementation and outcomes of the 21st Century Community Learning Centers (CCLC) program in West Virginia, from September 2012 through May 2013. The report draws on information from online surveys of directors of 30 CCLC programs and from school teachers for 4,102 participating students. Most participating students were in the elementary grades. The mean number of days students attended ranged from about 2 to 93 days, depending on the program. Teachers perceived the greatest improvements in participating students' behaviors related to promptness and quality of homework turned in, overall academic performance, and participation in class. Regarding CCLC program volunteers, the largest sources were K-12 service learning programs, parents and faculty members, local businesses, and postsecondary service learning programs. The groups with which program directors reported the greatest level of success were ""other"" (100%) and service learning K-12 (99.7%). Regarding work with partners, the two most frequent types of support received from partners were programming and resources. Partnerships engaged in funding, programming, resources, and training were reported to be the most effective. Regarding professional development, the topics best attended by program directors were programming, STEM/STEAM, and program evaluation. As for parent and community involvement, more than half of program directors indicated they either had no family components in their programs or that they were, at best, well below target goals. Of those who reported success in this area, three main themes emerged as reasons for their successes: (a) the right types of activities; (b) ongoing, even daily contact with parents; and (c) a shared commitment to the program, which involved engaging parents in meaningful work toward program goals. Program directors reported offering more than 600 substance abuse prevention activities, involving more than 7,000 students and nearly 1,600 adults. Nearly three quarters of program directors found the continuous improvement process for after school moderately or very helpful. Likewise, the great majority found the West Virginia Department of Education monitoring visits moderately or very helpful. The following are appended: (1) Teacher Questionnaire; (2) Program Director Questionnaire; and (3) Program Directors' Comments. [For the summary of this report, see ""21st Century Community Learning Centers 2013: A Quasi-Experimental Investigation of Program Impacts on Student Achievement in Mathematics and Reading/Language Arts"" (ED569698). For the 2011-2012 report, see ED606730.]",False,No,1. Space related,,1871568800,ED569907,,Reports,,"White, Larry J.",,,,,,,"Report , Undefined , 143: Reports - Research , 160: Tests/Questionnaires",,,2014-03-01 00:00:00,,,,English,English,,124,,2014-03-01 00:00:00,West Virginia Department of Education,"Reports , Other Sources",2014.0,http://wvde.state.wv.us,"ERIC, © West Virginia Department of Education",,https://www.proquest.com/reports/21st-century-community-learning-centers/docview/1871568800/se-2?accountid=14480,,,,,"Elementary Secondary Education , West Virginia",,,1,,"7462ER3 10561ER3 3693ER3 6691ER3 7429ER1 10514ER1 3679ER1 6663ER1 , 8432ER3 155ER3 4479ER3 8395ER1 155ER1 4459ER1 , 183ER3 10561ER3 3693ER3 6691ER3 183ER1 10514ER1 3679ER1 6663ER1 , 10763ER3 10561ER3 3693ER3 6691ER3 10714ER1 10514ER1 3679ER1 6663ER1 , 532ER3 8974ER3 8622ER3 532ER1 8935ER1 8584ER1 , 10411ER3 7746ER3 921ER3 10357ER3 10365ER1 7711ER1 921ER1 10311ER1 , 10357ER3 921ER3 10311ER1 921ER1 , 4917ER3 685ER3 5331ER3 4902ER3 10461ER3 5981ER3 128ER3 4896ER1 685ER1 5309ER1 4881ER1 10415ER1 5957ER1 128ER1 , 29ER3 98ER3 29ER1 98ER1 , 9709ER3 3757ER3 5980ER3 9668ER1 3743ER1 5956ER1 , 7755ER3 3236ER3 2251ER3 921ER3 7720ER1 3223ER1 2248ER1 921ER1 , 8868ER3 8829ER1 , 923ER3 1404ER3 923ER1 1404ER1 , 926ER3 2123ER3 926ER1 2120ER1 , 11583ER3 8149ER3 4625ER3 11527ER1 8114ER1 4605ER1 , 5234ER3 155ER3 4479ER3 5212ER1 155ER1 4459ER1 , 82ER3 82ER1 , 3854ER3 8400ER3 5802ER3 2826ER3 10176ER3 3839ER1 8363ER1 5778ER1 2820ER1 10133ER1 , 3306ER3 3293ER1 , 10828ER3 10779ER1 , 7681ER3 7746ER3 921ER3 7646ER1 7711ER1 921ER1 , 1935ER3 7746ER3 921ER3 1932ER1 7711ER1 921ER1 , 1924ER3 3205ER3 1921ER1 3192ER1 , 7844ER3 5216ER3 7809ER1 5194ER1 , 886ER3 8376ER3 886ER1 8339ER1 , 10486ER3 921ER3 10440ER1 921ER1 , 8448ER3 5087ER3 8411ER1 5066ER1 , 89ER3 9083ER3 89ER1 9044ER1 , 10497ER3 7833ER3 921ER3 10450ER1 7798ER1 921ER1 , 1406ER3 6691ER3 1406ER1 6663ER1 , 8443ER3 8406ER1 , 8445ER3 3690ER3 8408ER1 3676ER1 , West Virginia","Elementary Secondary Education , West Virginia",,https://libkey.io/libraries/1768/openurl?genre=report&amp;au=White%2C+Larry+J.&amp;aulast=White&amp;issn=&amp;isbn=&amp;title=21st+Century+Community+Learning+Centers%3A+A+Descriptive+Evaluation+for+2012-2013&amp;jtitle=&amp;pubname=21st+Century+Community+Learning+Centers%3A+A+Descriptive+Evaluation+for+2012-2013&amp;btitle=21st+Century+Community+Learning+Centers%3A+A+Descriptive+Evaluation+for+2012-2013&amp;atitle=&amp;volume=&amp;issue=&amp;spage=1&amp;date=2014&amp;doi=&amp;sid=ProQuest,ERIC
4-H FAB LAB DEBUTS,"The first public school Fab Lab in Arizona and the first 4-H Foundation Fab Lab in the US recently held its grand opening at Blue Ridge High School in Lakeside AZ. Funded by the University of Arizona, this Fab Lab, designed to train the next generation of Science, Technology, Engineering, Art and Math (STEAM) professionals via real-world digital fabrication hardware and software, offers students access to a variety of digital fabrication machines, such as Roland DGA's (Irvine, CA) MDX-40A milling machine, LEF-12 flatbed UV printer, SP-300i wide-format printer/cutter and GS-24 desktop vinyl cutter.",False,No,1. Space related,,2249190741,,,Magazines,,Anonymous,,,,Copyright S.T. Publications Mar 2018,,,News,,,2018-03-01 00:00:00,,0037-5063,3,English,English,,,Cincinnati,2018-03-01 00:00:00,Signs of the Times,,2018.0,,,240,https://www.proquest.com/magazines/4-h-fab-lab-debuts/docview/2249190741/se-2?accountid=14480,,,,,,,,,,"Public schools , Science education , Machinery , Arizona , United States--US",,,https://libkey.io/libraries/1768/openurl?genre=article&amp;au=Anonymous&amp;aulast=Anonymous&amp;issn=00375063&amp;isbn=&amp;title=4-H+FAB+LAB+DEBUTS&amp;jtitle=Signs+of+the+Times&amp;pubname=Signs+of+the+Times&amp;btitle=&amp;atitle=4-H+FAB+LAB+DEBUTS&amp;volume=240&amp;issue=3&amp;spage=&amp;date=2018&amp;doi=&amp;sid=ProQuest,Design & Applied Arts Index (DAAI)
A Pandemic as the Mother of Invention? Collegial Online Collaboration to Cope with the COVID-19 Pandemic,"This article aims to present how music teachers in Sweden used the facebook group ""Musiklärarna"" in the first two months of the COVID-19 pandemic (March and April, 2020) to cope with challenges related to teaching music. The study is based on Biesta's perspective on the teacher profession. With the consent of the participants, we have analysed the 303 posts (and their comments) that directly addressed the COVID-19 situation during that period. We found that the group works as an important collegial forum and that the teachers pragmatically use the group to solve educational problems; further, the posts concerning work-conditions get the most engagement. The most frequent types of posts concerned how to design teaching situations under the new conditions. Specifically, ""asking questions,"" ""sharing material,"" ""asking for material"" and ""letting off steam"" were the most common types. Music teachers seem to be loyal, collegial and intent on solving any challenge to facilitate students' learning as regulated in the syllabus. We hope this article can motivate other researchers to perform similar studies or build on our results. We conclude by speculating about what the new normal will be for music teachers when the pandemic is over.",False,No,1. Space related,,2540354031,EJ1295844,,Scholarly Journals,,"Thorgersen, Ketil A.;Mars, Annette",,,,,,10.1080/14613808.2021.1906216,"Report , Article",,,2021,,1461-3808,2,English,English,,225-240,,2021,Music Education Research,"Scholarly Journals , Reports",2021.0,http://www.tandf.co.uk/journals,"ERIC, © Routledge",23,https://www.proquest.com/scholarly-journals/pandemic-as-mother-invention-collegial-online/docview/2540354031/se-2?accountid=14480,,,,,Elementary Secondary Education,,,225,,"7029ER3 633ER3 3205ER3 6997ER1 633ER1 3192ER1 , 2398ER3 1875ER3 2966ER3 2919ER3 2395ER1 1873ER1 2958ER1 2911ER1 , 7634ER3 7600ER1 , 1842ER3 5541ER3 8915ER3 1840ER1 5519ER1 8876ER1 , 10678ER3 3236ER3 2251ER3 921ER3 10670ER3 10629ER1 3223ER1 2248ER1 921ER1 10621ER1 , 2270ER3 152ER3 921ER3 2267ER1 152ER1 921ER1 , 152ER3 921ER3 152ER1 921ER1 , 9335ER3 9294ER1 , 7453ER3 2102ER3 2101ER3 10860ER3 2382ER3 2548ER3 7420ER1 2099ER1 2098ER1 10811ER1 2379ER1 2544ER1 , 9946ER3 2071ER3 1876ER3 10866ER3 1889ER3 10854ER3 6469ER3 9903ER1 2068ER1 1874ER1 10816ER1 1887ER1 10805ER1 6441ER1 , 7032ER3 10775ER3 8410ER3 3478ER3 5801ER3 4996ER3 9069ER3 8149ER3 4625ER3 7000ER1 10726ER1 8373ER1 3464ER1 5777ER1 4975ER1 9030ER1 8114ER1 4605ER1 , 4185ER3 4414ER3 4166ER1 4394ER1 , 3426ER3 3205ER3 3412ER1 3192ER1 , Sweden",Elementary Secondary Education,,https://libkey.io/libraries/1768/openurl?genre=article&amp;au=Thorgersen%2C+Ketil+A.%3BMars%2C+Annette&amp;aulast=Thorgersen&amp;issn=14613808&amp;isbn=&amp;title=A+Pandemic+as+the+Mother+of+Invention%3F+Collegial+Online+Collaboration+to+Cope+with+the+COVID-19+Pandemic&amp;jtitle=Music+Education+Research&amp;pubname=Music+Education+Research&amp;btitle=&amp;atitle=A+Pandemic+as+the+Mother+of+Invention%3F+Collegial+Online+Collaboration+to+Cope+with+the+COVID-19+Pandemic&amp;volume=23&amp;issue=2&amp;spage=225&amp;date=2021&amp;doi=10.1080%2F14613808.2021.1906216&amp;sid=ProQuest,ERIC
A Place for Art and Design Education in the STEM Conversation,"The recent push for STEM (Science, Technology, Engineering, and Mathematics) education introduces (through the emphasis on engineering) a ""design process"" to science classrooms; some educators have also pushed for the ""artistic or creative process"" becoming a part of STEM education. In certain cases, this might be an opportunity for greater prominence for art education, better art and STEM learning, and heightened student engagement; in others it might weaken each discipline and confuse the boundaries between different approaches. In what follows we describe the possibilities and pitfalls of an approach that infuses both the creative process and design thinking into a new iteration of STEM education that adds arts (with a capital ""A"") to the acronym to make STEAM. (Contains 4 figures.)",False,No,1. Space related,Yes,1037908757,EJ974416,,Scholarly Journals,,"Bequette, James W.;Bequette, Marjorie Bullitt",,,,,,,"Article , Report , 080: Journal Articles , 141: Reports - Descriptive",,,2012-03-01 00:00:00,,0004-3125,2,English,English,,40-47,,2012-03-01 00:00:00,Art Education,"Scholarly Journals , Reports",2012.0,http://www.arteducators.org,"ERIC, © National Art Education Association",65,https://www.proquest.com/scholarly-journals/place-art-design-education-stem-conversation/docview/1037908757/se-2?accountid=14480,,,,,,,,40,,"2416ER3 10805ER3 3283ER3 6691ER3 2413ER1 10756ER1 3270ER1 6663ER1 , 633ER3 3205ER3 633ER1 3192ER1 , 10280ER3 3205ER3 10236ER1 3192ER1 , 2805ER3 2799ER1 , 5458ER3 6691ER3 5436ER1 6663ER1 , 2420ER3 8553ER3 5140ER3 2417ER1 8516ER1 5118ER1 , 10805ER3 3283ER3 6691ER3 10756ER1 3270ER1 6663ER1 , 266ER3 7939ER3 5006ER3 6069ER3 266ER1 7904ER1 4985ER1 6042ER1",,,https://libkey.io/libraries/1768/openurl?genre=article&amp;au=Bequette%2C+James+W.%3BBequette%2C+Marjorie+Bullitt&amp;aulast=Bequette&amp;issn=00043125&amp;isbn=&amp;title=A+Place+for+Art+and+Design+Education+in+the+STEM+Conversation&amp;jtitle=Art+Education&amp;pubname=Art+Education&amp;btitle=&amp;atitle=A+Place+for+Art+and+Design+Education+in+the+STEM+Conversation&amp;volume=65&amp;issue=2&amp;spage=40&amp;date=2012&amp;doi=&amp;sid=ProQuest,ERIC
"A review of the effect of integrated STEM or STEAM (science, technology, engineering, arts, and mathematics) education in South Korea","Integrated STEAM education in South Korea is an approach to preparing a quality STEM workforce and literate citizens for highly technology-based society. Through a literature review, this study examined the STEAM education initiative in South Korea and investigated its effects on learning and teaching. Studies in South Korea found that teacher professional development courses increased teachers’ recognition of the initiative as well as their confidence in teaching STEAM. Teacher interviews showed that coaching in classroom practices within teachers’ professional development was helpful. Although studies reported that many science teachers adopted STEAM in science teaching, there was a lack of research on how teachers taught STEAM lessons, let alone the connections between teachers’ perceptions of STEAM and their classroom practices. As for STEAM effects on student learning, a number of meta-analyses showed that students’ experiences with STEAM were effective in both cognitive and affective learning. The effect was higher in affective domains. Interviews with college students who had STEAM experiences in grade school showed that the effects could be long-term. The meta-analysis studies failed to identify significant mediating factors, which required further in-depth research on how contextual variables function in student learning. This paper provides a glimpse of what can be achieved through STEAM efforts, and what should be further researched for better theory and practice.",False,No,1. Space related,,2562249191,,,Scholarly Journals,,"Nam-Hwa, Kang",,,,"Copyright Brill Academic Publishers, Inc. Mar 2019",,10.1186/s41029-019-0034-y,Review,,2019-03-29,2019-03-01 00:00:00,,,1,English,English,,1-22,Leiden,2019-03-01 00:00:00,Asia-Pacific Science Education,,2019.0,,,5,https://www.proquest.com/scholarly-journals/review-effect-integrated-stem-steam-science/docview/2562249191/se-2?accountid=14480,,,,,"Integrated STEM , STEAM , STEAM pedagogies , STEM pedagogies , STEAM effects",,,1,,"Teaching , Science education , Learning , Teachers , Professional development , South Korea","Integrated STEM , STEAM , STEAM pedagogies , STEM pedagogies , STEAM effects",,https://libkey.io/libraries/1768/openurl?genre=article&amp;au=Nam-Hwa%2C+Kang&amp;aulast=Nam-Hwa&amp;issn=&amp;isbn=&amp;title=A+review+of+the+effect+of+integrated+STEM+or+STEAM+%28science%2C+technology%2C+engineering%2C+arts%2C+and+mathematics%29+education+in+South+Korea&amp;jtitle=Asia-Pacific+Science+Education&amp;pubname=Asia-Pacific+Science+Education&amp;btitle=&amp;atitle=A+review+of+the+effect+of+integrated+STEM+or+STEAM+%28science%2C+technology%2C+engineering%2C+arts%2C+and+mathematics%29+education+in+South+Korea&amp;volume=5&amp;issue=1&amp;spage=1&amp;date=2019&amp;doi=10.1186%2Fs41029-019-0034-y&amp;sid=ProQuest,Publicly Available Content Database
A Study of Enhancing Computational Thinking Skills through STEAM Robotics Activities,"STEAM robotics activities are designed to be an enhancement on students’ computational thinking skills, which are claimed to be essential for the 21st century. The aims of this study were to examine the learning outcomes of secondary students’ computational thinking skills through the use of STEAM robotics activities, and to investigate the students’ satisfaction after the implementation of STEAM robotics activities. A quasi-experimental research design was deployed in this study. The research participants were 37 eleventh-grade students of Private Islamic Schools in Yala province, Thailand. A quiz with pre- and post-test and satisfaction questionnaires were employed as data. Descriptive statistics – including mean, standard deviation and a pair sample t-test – was used to analyse the collected data. The findings were that students’ learning outcomes indicated a significant improvement in their computational skills after the use of STEAM robotics activities as compared with before, with the statistical level of significance of 0.05. In response to the second research question, the overall satisfaction of the students after the use of such STEAM robotics activities was high (mean=4.01; SD=0.54).",False,No,1. Space related,,2511968447,,,Scholarly Journals,"Computer Education Program, Faculty of Science Technology and Agriculture, Yala Rajabhat University, Yala 95000, Thailand , Information Technology Program, Faculty of Science Technology and Agriculture, Yala Rajabhat University, Yala 95000, Thailand , Computer Science Program, Faculty of Science Technology and Agriculture, Yala Rajabhat University, Yala 95000, Thailand","Phadung, Muneeroh;Yokkhun, Atcharaporn;Sulaiman Persoh",,,,"© 2021. This work is published under http://creativecommons.org/licenses/by/3.0/ (the “License”). Notwithstanding the ProQuest Terms and Conditions, you may use this content in accordance with the terms of the License.",,10.1088/1742-6596/1835/1/012004,Conference Proceedings,,2021-04-12,2021-03-01 00:00:00,,1742-6588,1,English,English,,,Bristol,2021-03-01 00:00:00,Journal of Physics: Conference Series,,2021.0,,,1835,https://www.proquest.com/scholarly-journals/study-enhancing-computational-thinking-skills/docview/2511968447/se-2?accountid=14480,,,,,,,2021-03-01 (openaccess),,,"Robotics , Students , Mean , Learning , Critical thinking , Statistical tests , Data collection , Skills , Students , Robotics",,,https://libkey.io/libraries/1768/openurl?genre=proceeding&amp;au=Phadung%2C+Muneeroh%3BYokkhun%2C+Atcharaporn%3BSulaiman+Persoh&amp;aulast=Phadung&amp;issn=17426588&amp;isbn=&amp;title=A+Study+of+Enhancing+Computational+Thinking+Skills+through+STEAM+Robotics+Activities&amp;jtitle=Journal+of+Physics%3A+Conference+Series&amp;pubname=Journal+of+Physics%3A+Conference+Series&amp;btitle=&amp;atitle=A+Study+of+Enhancing+Computational+Thinking+Skills+through+STEAM+Robotics+Activities&amp;volume=1835&amp;issue=1&amp;spage=&amp;date=2021&amp;doi=10.1088%2F1742-6596%2F1835%2F1%2F012004&amp;sid=ProQuest,Publicly Available Content Database
